UniversityID,Campus,Faculty,FacultyID
f9f0a05fbac13ce20a2af52247c2b93f,Burgos,Escuela Politécnica Superior,43342d8761b05d4e4f644f5ce364c7cd
f9f0a05fbac13ce20a2af52247c2b93f,Burgos,Facultad de Ciencias,5aa89c7c58e1f19101c5e8cc03b23372
f9f0a05fbac13ce20a2af52247c2b93f,Burgos,Facultad de Ciencias de la Salud,f921a09e12f17ed6eeff834c0547457c
f9f0a05fbac13ce20a2af52247c2b93f,Burgos,Facultad de Ciencias Económicas y Empresariales,e1093a1e338895b3aa7cc9fa53069d23
f9f0a05fbac13ce20a2af52247c2b93f,Burgos,Facultad de Derecho,98f394722d47c37452079e3e4377547a
f9f0a05fbac13ce20a2af52247c2b93f,Burgos,Facultad de Educación,fe8ea443c7900681952215f533745654
f9f0a05fbac13ce20a2af52247c2b93f,Burgos,Facultad de Humanidades y Comunicación,31ae09155e08904a62b953a3476bd843
f9f0a05fbac13ce20a2af52247c2b93f,,Escuela Politécnica Superior,43342d8761b05d4e4f644f5ce364c7cd
c8b4be930789e86c8d8b17d773af6d7e,León,Escuela de Ingeniería Agraria y Forestal,19379b73b3b7ab8db4d1b3b0b92c4e3f
c8b4be930789e86c8d8b17d773af6d7e,León,"Escuela de Ingenierías Industrial, Informática y Aeroespacial",ddca0f084c851a01517835d5bd122ecf
c8b4be930789e86c8d8b17d773af6d7e,León,Escuela Superior y Técnica de Ingenieros de Minas,9952fa217aab3225a9450c1dd24ff66b
c8b4be930789e86c8d8b17d773af6d7e,León,Escuela Universitaria de Trabajo Social,47bb3a3a9d09115de1b4c1b4cd407db0
c8b4be930789e86c8d8b17d773af6d7e,León,Facultad de Ciencias Biológicas y Ambientales,fe2fbde5936b071cd86eec32718c53be
c8b4be930789e86c8d8b17d773af6d7e,León,Facultad de Ciencias de la Actividad Física y del Deporte,010a719fb876dabd413a8cdcd2521d8e
c8b4be930789e86c8d8b17d773af6d7e,León,Facultad de Ciencias de la Salud,48d729a2d82d7dfa63a093f960271a46
c8b4be930789e86c8d8b17d773af6d7e,León,Facultad de Ciencias del Trabajo,49f1becb705172968ad7b5dfb966b9e6
c8b4be930789e86c8d8b17d773af6d7e,León,Facultad de Ciencias Económicas y Empresariales,61484ca2077ed5641c3471001a312e8f
c8b4be930789e86c8d8b17d773af6d7e,León,Facultad de Derecho,d4a0fc7db565bf0347c3c31da46a6ba6
c8b4be930789e86c8d8b17d773af6d7e,León,Facultad de Educación,8d318407c4596aa8e2c7af34b1adf9f5
c8b4be930789e86c8d8b17d773af6d7e,León,Facultad de Filosofía y Letras,193c5d38f0565f9a97c3ca11208a2e49
c8b4be930789e86c8d8b17d773af6d7e,León,Facultad de Veterinaria,826864c3f9cf213b2dfb13d2eb7010c1
c8b4be930789e86c8d8b17d773af6d7e,Ponferrada,Escuela de Ingeniería Agraria y Forestal,19379b73b3b7ab8db4d1b3b0b92c4e3f
c8b4be930789e86c8d8b17d773af6d7e,Ponferrada,Escuela Superior y Técnica de Ingenieros de Minas,9952fa217aab3225a9450c1dd24ff66b
c8b4be930789e86c8d8b17d773af6d7e,Ponferrada,Facultad de Ciencias de la Salud,48d729a2d82d7dfa63a093f960271a46
51dcd00716a08519e65a732cb87c3b71,Ávila,"Centro Universitario de Formación de la Policía Nacional, O.A.",12ca7a59a88ed75e4a1a78c60ef11dba
51dcd00716a08519e65a732cb87c3b71,Ávila,Escuela Politécnica Superior de Ávila,d041033ef410d0bf92f124356606f599
51dcd00716a08519e65a732cb87c3b71,Ávila,Escuela Universitaria de Educación y Turismo,dcd7aba401c7dc4879a5c8628a85635a
51dcd00716a08519e65a732cb87c3b71,Ávila,Escuela Universitaria de Enfermería de Avila,e63f0c07b952cdb2548981ddf60fa34e
51dcd00716a08519e65a732cb87c3b71,Béjar,Escuela Técnica Superior de Ingeniería Industrial,b09cc60ffab6c1b501bd6be27c9fc593
51dcd00716a08519e65a732cb87c3b71,Salamanca,Escuela Aeronáutica Adventia (European College of Aeronautics),da5f17f56f91db0d2ceec1ae7ab979f5
51dcd00716a08519e65a732cb87c3b71,Salamanca,Facultad de Bellas Artes,85c7cf4d3a8616439a36a15f716bb6ff
51dcd00716a08519e65a732cb87c3b71,Salamanca,Facultad de Biología,09975c2d372ec3198a55f6a065c3a205
51dcd00716a08519e65a732cb87c3b71,Salamanca,Facultad de Ciencias,a1849df95c0c502b7375204caa728d77
51dcd00716a08519e65a732cb87c3b71,Salamanca,Facultad de Ciencias Agrarias y Ambientales,3bfd3c13054fe54f01dd772dc5cadbcb
51dcd00716a08519e65a732cb87c3b71,Salamanca,Facultad de Ciencias Químicas,95c6e6249b07a4f2c6b5e4bbddd65332
51dcd00716a08519e65a732cb87c3b71,Salamanca,Facultad de Ciencias Sociales,6f1fd12a3e77e002f3966f645dafb14a
51dcd00716a08519e65a732cb87c3b71,Salamanca,Facultad de Derecho,20ceb88f79dfc21dddd297776048cd33
51dcd00716a08519e65a732cb87c3b71,Salamanca,Facultad de Economía y Empresa,0514b2c2384475c33f18e17f5a34a28e
51dcd00716a08519e65a732cb87c3b71,Salamanca,Facultad de Educación,ed5cd854cc9ef4200b9a255c582b262b
51dcd00716a08519e65a732cb87c3b71,Salamanca,Facultad de Enfermería y Fisioterapia,af9148acb034809ec6579eb9971acdbf
51dcd00716a08519e65a732cb87c3b71,Salamanca,Facultad de Farmacia,8986862b928dd0b281889942854a3cbe
51dcd00716a08519e65a732cb87c3b71,Salamanca,Facultad de Filología,8be98f813e5c23545ee97fc26563fe60
51dcd00716a08519e65a732cb87c3b71,Salamanca,Facultad de Filosofía,8e888203488460cdd6b05cc549af38af
51dcd00716a08519e65a732cb87c3b71,Salamanca,Facultad de Geografía e Historia,1547076cf3f907a87ff796fb6de28439
51dcd00716a08519e65a732cb87c3b71,Salamanca,Facultad de Medicina,667199033383e345f66d924e153f7608
51dcd00716a08519e65a732cb87c3b71,Salamanca,Facultad de Psicología,c53569948d193612ae9699e741d74ef2
51dcd00716a08519e65a732cb87c3b71,Salamanca,Facultad de Traducción y Documentación,62bb2b4ced5c6b99a3889d691506c75b
51dcd00716a08519e65a732cb87c3b71,Zamora,Escuela Politécnica Superior de Zamora,c240b7563ffee4e24e404bf6d71e4f75
51dcd00716a08519e65a732cb87c3b71,Zamora,Escuela Universitaria de Enfermería SACYL,c81ffdc31c5cda5406af9998bf51002c
51dcd00716a08519e65a732cb87c3b71,Zamora,Escuela Universitaria de Magisterio,04899fbc8f3d8799cb62ae7d3c1bfd97
51dcd00716a08519e65a732cb87c3b71,Zamora,Escuela Universitaria de Relaciones Laborales,b693052e3fdc7cf3e502b113a7b22c82
92c081b3e4299316155ea45962241086,Palencia,Escuela Técnica Superior de Ingenierías Agrarias,fa97a8ea7278fa8686b8e6c6736860f0
92c081b3e4299316155ea45962241086,Palencia,Escuela Universitaria de Enfermería Dr.Dacio Crespo de Palencia (Adscrita a la UVa),f58aecfd5d821b9678eb5a7448b28e8e
92c081b3e4299316155ea45962241086,Palencia,Facultad de Ciencias del Trabajo,37ed05782e1e8c35310b0f7db5977ef3
92c081b3e4299316155ea45962241086,Palencia,Facultad de Educación de Palencia,b6659d48fcabcfaf5be32a61923f391e
92c081b3e4299316155ea45962241086,Segovia,Escuela de Ingeniería Informática de Segovia,810d5ca3e71c60c2835746272d0f8aab
92c081b3e4299316155ea45962241086,Segovia,"Facultad de Ciencias Sociales, Jurídicas y de la Comunicación",385523125b48d8f03dae99a8ca77c0c1
92c081b3e4299316155ea45962241086,Segovia,Facultad de Educación de Segovia,7f47b3319134574d4ef3df2048c9858d
92c081b3e4299316155ea45962241086,Segovia,Facultad de Enfermería sede Segovia,2fa8c0e93e14be01a3292d681ca1741f
92c081b3e4299316155ea45962241086,Soria,"Escuela de Ingeniería de la Industria Forestal, Agronómica y de la Bioenergía",6e66f66a46d2c132fabfa72655ff15bd
92c081b3e4299316155ea45962241086,Soria,Facultad de Ciencias de la Salud,15179a9e1b42ddc3ccc70f7626dc0ca2
92c081b3e4299316155ea45962241086,Soria,Facultad de Ciencias Empresariales y del Trabajo de Soria,09a39c0b521c71ca08c9b5466e6f981e
92c081b3e4299316155ea45962241086,Soria,Facultad de Educación de Soria,c228aa01dd2fd6ae0ed513474c1fe569
92c081b3e4299316155ea45962241086,Soria,Facultad de Traducción e Interpretación,6d64844cfca517ac79edca8f5a67d914
92c081b3e4299316155ea45962241086,Valladolid,Escuela de Ingeniería Informática de Valladolid,525dd8cf5a08036b4415fa391175cd9a
92c081b3e4299316155ea45962241086,Valladolid,Escuela de Ingenierías Industriales,ad8e9a7d8d7c49296c9a919248a3db1a
92c081b3e4299316155ea45962241086,Valladolid,Escuela Técnica Superior de Arquitectura,e9adf88b14fb2f320240cd9892b53c60
92c081b3e4299316155ea45962241086,Valladolid,Escuela Técnica Superiorde  Ingenieros de Telecomunicación,08798eaf5fce6d61a1d600bb84c20771
92c081b3e4299316155ea45962241086,Valladolid,Facultad de Ciencias,47067f6b754243f1a53069a9a7c03b11
92c081b3e4299316155ea45962241086,Valladolid,Facultad de Ciencias Económicas y  Empresariales,cb1839d202d3eda23b2cdc2b09cbe45c
92c081b3e4299316155ea45962241086,Valladolid,Facultad de Comercio,71e65021f1c5310652d72a264dd75418
92c081b3e4299316155ea45962241086,Valladolid,Facultad de Derecho,b04ea75e4e7867de5ff40c48c1ed9e85
92c081b3e4299316155ea45962241086,Valladolid,Facultad de Educación y Trabajo Social,9afb21bf82875e1e498644508e286549
92c081b3e4299316155ea45962241086,Valladolid,Facultad de Enfermería,22098430e05b5b783a5f995e3e8517c7
92c081b3e4299316155ea45962241086,Valladolid,Facultad de Filosofia  y Letras,b1bd7418e42f38955c538847bcbe22e4
92c081b3e4299316155ea45962241086,Valladolid,Facultad de Medicina,3e4bb48648712c3477346224adffcfc4
