"Código","Título","Universidad","Nivel académico","Rama","Ámbito","Estado","Detalle"
"2500935","Graduado o Graduada en Edificación por la Universitat de les Illes Balears","Universitat de les Illes Balears","Grado - RD 1393/2007 (1)","Ingeniería y Arquitectura","Arquitectura, construcción, edificación y urbanismo, e ingeniería civil","Publicado en B.O.E.","(TITULACIÓN RENOVADA)"
"2500933","Graduado o Graduada en Educación Infantil por la Universitat de les Illes Balears","Universitat de les Illes Balears","Grado - RD 1393/2007 (1)","Ciencias Sociales y Jurídicas","Ciencias de la educación","Publicado en B.O.E.","(TITULACIÓN RENOVADA)"
"2500986","Graduado o Graduada en Educación Primaria por la Universitat de les Illes Balears","Universitat de les Illes Balears","Grado - RD 1393/2007 (1)","Ciencias Sociales y Jurídicas","Ciencias de la educación","Publicado en B.O.E.","(TITULACIÓN RENOVADA)"
"2500336","Graduado o Graduada en Educación Social por la Universitat de les Illes Balears","Universitat de les Illes Balears","Grado - RD 1393/2007 (1)","Ciencias Sociales y Jurídicas","Ciencias de la educación","Publicado en B.O.E.","(TITULACIÓN RENOVADA)"
"2500930","Graduado o Graduada en Enfermería por la Universitat de les Illes Balears","Universitat de les Illes Balears","Grado - RD 1393/2007 (1)","Ciencias de la Salud","Enfermería","Publicado en B.O.E.","(TITULACIÓN RENOVADA)"
"2500331","Graduado o Graduada en Estudios Ingleses por la Universitat de les Illes Balears","Universitat de les Illes Balears","Grado - RD 1393/2007 (1)","Artes y Humanidades","Filología, estudios clásicos, traducción y lingüística","Publicado en B.O.E.","(TITULACIÓN RENOVADA)"
"2504674","Graduado o Graduada en Farmacia por la Universitat de les Illes Balears","Universitat de les Illes Balears","Grado - RD 1393/2007 (1)","Ciencias de la Salud","","Publicado en B.O.E.",""
"2500701","Graduado o Graduada en Filosofía por la Universitat de les Illes Balears","Universitat de les Illes Balears","Grado - RD 1393/2007 (1)","Artes y Humanidades","","Publicado en B.O.E.","(TITULACIÓN RENOVADA)"
"2500334","Graduado o Graduada en Física por la Universitat de les Illes Balears","Universitat de les Illes Balears","Grado - RD 1393/2007 (1)","Ciencias","Física y astronomía","Publicado en B.O.E.","(TITULACIÓN RENOVADA)"
"2500931","Graduado o Graduada en Fisioterapia por la Universitat de les Illes Balears","Universitat de les Illes Balears","Grado - RD 1393/2007 (1)","Ciencias de la Salud","Fisioterapia, podología, nutrición y dietética, terapia ocupacional, óptica y optometría y logopedia","Publicado en B.O.E.","(TITULACIÓN RENOVADA)"
"2500702","Graduado o Graduada en Geografía por la Universitat de les Illes Balears","Universitat de les Illes Balears","Grado - RD 822/2021 (2)","Ciencias Sociales y Jurídicas","Historia, arqueología, geografía, filosofía y humanidades","Publicado en B.O.E.","(TITULACIÓN RENOVADA)"
"2500784","Graduado o Graduada en Historia del Arte por la Universitat de les Illes Balears","Universitat de les Illes Balears","Grado - RD 1393/2007 (1)","Artes y Humanidades","Historia del arte y de la expresión artística, y bellas artes","Publicado en B.O.E.","(TITULACIÓN RENOVADA)"
"2500511","Graduado o Graduada en Historia por la Universitat de les Illes Balears","Universitat de les Illes Balears","Grado - RD 1393/2007 (1)","Artes y Humanidades","Historia, arqueología, geografía, filosofía y humanidades","Publicado en B.O.E.","(TITULACIÓN RENOVADA)"
"2502341","Graduado o Graduada en Ingeniería Agroalimentaria y del Medio Rural por la Universitat de les Illes Balears","Universitat de les Illes Balears","Grado - RD 1393/2007 (1)","Ingeniería y Arquitectura","Ingeniería química, ingeniería de los materiales e ingeniería del medio natural","Publicado en B.O.E.","(TITULACIÓN RENOVADA)"
"2502134","Graduado o Graduada en Ingeniería Electrónica Industrial y Automática por la Universitat de les Illes Balears","Universitat de les Illes Balears","Grado - RD 1393/2007 (1)","Ingeniería y Arquitectura","Ingeniería industrial, ingeniería mecánica, ingeniería automática, ingeniería de la organización industrial e ingeniería de la navegación","Publicado en B.O.E.","(TITULACIÓN RENOVADA)"
"2502135","Graduado o Graduada en Ingeniería Informática por la Universitat de les Illes Balears","Universitat de les Illes Balears","Grado - RD 1393/2007 (1)","Ingeniería y Arquitectura","","Publicado en B.O.E.","(TITULACIÓN RENOVADA)"
"2502136","Graduado o Graduada en Ingeniería Telemática por la Universitat de les Illes Balears","Universitat de les Illes Balears","Grado - RD 1393/2007 (1)","Ingeniería y Arquitectura","Ingeniería eléctrica, ingeniería electrónica e ingeniería de la telecomunicación","Publicado en B.O.E.","(TITULACIÓN RENOVADA)"
"2500332","Graduado o Graduada en Lengua y Literatura Catalanas por la Universitat de les Illes Balears","Universitat de les Illes Balears","Grado - RD 1393/2007 (1)","Artes y Humanidades","Filología, estudios clásicos, traducción y lingüística","Publicado en B.O.E.","(TITULACIÓN RENOVADA)"
"2500333","Graduado o Graduada en Lengua y Literatura Españolas por la Universitat de les Illes Balears","Universitat de les Illes Balears","Grado - RD 1393/2007 (1)","Artes y Humanidades","Filología, estudios clásicos, traducción y lingüística","Publicado en B.O.E.","(TITULACIÓN RENOVADA)"
"2500777","Graduado o Graduada en Matemáticas por la Universitat de les Illes Balears","Universitat de les Illes Balears","Grado - RD 822/2021 (2)","Ingeniería y Arquitectura","Matemáticas y estadística","Publicado en B.O.E.","(TITULACIÓN RENOVADA)"
"2503367","Graduado o Graduada en Medicina por la Universitat de les Illes Balears","Universitat de les Illes Balears","Grado - RD 1393/2007 (1)","Ciencias de la Salud","","Publicado en B.O.E.","(TITULACIÓN RENOVADA)"
"2504028","Graduado o Graduada en Nutrición Humana y Dietética por la Universitat de les Illes Balears","Universitat de les Illes Balears","Grado - RD 1393/2007 (1)","Ciencias de la Salud","","Publicado en B.O.E.",""
"2503521","Graduado o Graduada en Odontología por la Universitat de les Illes Balears","Universitat de les Illes Balears","Grado - RD 822/2021 (2)","Ciencias de la Salud","Medicina y Odontología","Publicado en B.O.E.","(TITULACIÓN RENOVADA)"
"2500338","Graduado o Graduada en Pedagogía por la Universitat de les Illes Balears","Universitat de les Illes Balears","Grado - RD 822/2021 (2)","Ciencias Sociales y Jurídicas","Ciencias de la educación","Publicado en B.O.E.","(TITULACIÓN RENOVADA)"
"2500512","Graduado o Graduada en Periodismo por la Universitat de les Illes Balears","Universitat de les Illes Balears","Grado - RD 1393/2007 (1)","Ciencias Sociales y Jurídicas","","Publicado en B.O.E.","(TITULACIÓN A EXTINGUIR)"
"2503152","Graduado o Graduada en Protocolo y Organización de Eventos por la Universitat de les Illes Balears","Universitat de les Illes Balears","Grado - RD 1393/2007 (1)","Ciencias Sociales y Jurídicas","","Publicado en B.O.E.","(TITULACIÓN A EXTINGUIR)"
"2500335","Graduado o Graduada en Psicología por la Universitat de les Illes Balears","Universitat de les Illes Balears","Grado - RD 822/2021 (2)","Ciencias de la Salud","Ciencias del comportamiento y psicología","Publicado en B.O.E.","(TITULACIÓN RENOVADA)"
"2502907","Graduado o Graduada en Publicidad y Relaciones Públicas por la Universitat de les Illes Balears","Universitat de les Illes Balears","Grado - RD 1393/2007 (1)","Ciencias Sociales y Jurídicas","","Publicado en B.O.E.","(TITULACIÓN A EXTINGUIR)"
"2500790","Graduado o Graduada en Química por la Universitat de les Illes Balears","Universitat de les Illes Balears","Grado - RD 1393/2007 (1)","Ciencias","Química","Publicado en B.O.E.","(TITULACIÓN RENOVADA)"
"2502133","Graduado o Graduada en Relaciones Laborales por la Universitat de les Illes Balears","Universitat de les Illes Balears","Grado - RD 1393/2007 (1)","Ciencias Sociales y Jurídicas","Ciencias sociales, trabajo social, relaciones laborales y recursos humanos, sociología, ciencia política y relaciones internacionales","Publicado en B.O.E.","(TITULACIÓN RENOVADA)"
"2501150","Graduado o Graduada en Trabajo Social por la Universitat de les Illes Balears","Universitat de les Illes Balears","Grado - RD 1393/2007 (1)","Ciencias Sociales y Jurídicas","Ciencias sociales, trabajo social, relaciones laborales y recursos humanos, sociología, ciencia política y relaciones internacionales","Publicado en B.O.E.","(TITULACIÓN RENOVADA)"
"2501048","Graduado o Graduada en Turismo por la Universitat de les Illes Balears","Universitat de les Illes Balears","Grado - RD 1393/2007 (1)","Ciencias Sociales y Jurídicas","Ciencias económicas, administración y dirección de empresas, márquetin, comercio, contabilidad y turismo","Publicado en B.O.E.","(TITULACIÓN RENOVADA)"
"4313691","Máster Universitario en Abogacía y Procura por la Universitat de les Illes Balears","Universitat de les Illes Balears","Máster - RD 1393/2007 (1)","Ciencias Sociales y Jurídicas","","Publicado en B.O.E.","(TITULACIÓN RENOVADA)"
"4310524","Máster Universitario en Análisis, Planificación y Gestión en Áreas Litorales","Universitat de les Illes Balears","Máster - RD 1393/2007 (1)","Ciencias Sociales y Jurídicas","","Publicado en B.O.E.","(TITULACIÓN EXTINGUIDA)"
"4315495","Máster Universitario en Analítica de Datos e Inteligencia de Negocios por la Universitat de les Illes Balears","Universitat de les Illes Balears","Máster - RD 822/2021 (3)","Ciencias Sociales y Jurídicas","Ciencias económicas, administración y dirección de empresas, márquetin, comercio, contabilidad y turismo","Publicado en B.O.E.","(TITULACIÓN RENOVADA)"
"3002516","Máster Universitario en Avances en Física y Química para Profesionales","Universitat de les Illes Balears","Máster - RD 56/2005 (2)","Ingeniería y Arquitectura","","Autorizado por Comunidad Aut&oacute;noma","(TITULACIÓN EXTINGUIDA)"
"4310131","Máster Universitario en Biología de las Plantas en Condiciones Mediterráneas","Universitat de les Illes Balears","Máster - RD 1393/2007 (1)","Ciencias","","Publicado en B.O.E.","(TITULACIÓN EXTINGUIDA)"
"3000125","Máster Universitario en Biología de las Plantas en Condiciones Mediterráneas","Universitat de les Illes Balears","Máster - RD 56/2005 (2)","Ingeniería y Arquitectura","","Autorizado por Comunidad Aut&oacute;noma","(TITULACIÓN EXTINGUIDA)"
"4314265","Máster Universitario en Biotecnología en Salud por la Universitat de les Illes Balears","Universitat de les Illes Balears","Máster - RD 822/2021 (3)","Ciencias","Bioquímica y biotecnología","Publicado en B.O.E.","(TITULACIÓN RENOVADA)"
"4310714","Máster Universitario en Biotecnología, Genética y Biología Celular","Universitat de les Illes Balears","Máster - RD 1393/2007 (1)","Ciencias de la Salud","","Publicado en B.O.E.","(TITULACIÓN EXTINGUIDA)"
"3002520","Máster Universitario en Biotecnología, Genética y Biología Celular","Universitat de les Illes Balears","Máster - RD 56/2005 (2)","Ciencias de la Salud","","Autorizado por Comunidad Aut&oacute;noma","(TITULACIÓN EXTINGUIDA)"
"4311598","Máster Universitario en Ciencia y Tecnología Química","Universitat de les Illes Balears","Máster - RD 1393/2007 (1)","Ciencias","","Publicado en B.O.E.","(TITULACIÓN EXTINGUIDA)"
"3000123","Máster Universitario en Ciencia y Tecnología Química","Universitat de les Illes Balears","Máster - RD 56/2005 (2)","Ingeniería y Arquitectura","","Autorizado por Comunidad Aut&oacute;noma","(TITULACIÓN EXTINGUIDA)"
"4314201","Máster Universitario en Ciencia y Tecnología Química por la Universidad de las Illes Balears","Universitat de les Illes Balears","Máster - RD 822/2021 (3)","Ciencias","Química","Publicado en B.O.E.","(TITULACIÓN RENOVADA)"
"4312373","Máster Universitario en Ciencias Médicas y de la Salud","Universitat de les Illes Balears","Máster - RD 1393/2007 (1)","Ciencias de la Salud","","Publicado en B.O.E.","(TITULACIÓN EXTINGUIDA)"
"3002521","Máster Universitario en Ciencias Sociales Aplicadas a la Atención Sociosanitaria","Universitat de les Illes Balears","Máster - RD 56/2005 (2)","Ciencias de la Salud","","Autorizado por Comunidad Aut&oacute;noma","(TITULACIÓN EXTINGUIDA)"
"4310715","Máster Universitario en Ciencias Sociales Aplicadas a la Atención Sociosanitaria","Universitat de les Illes Balears","Máster - RD 1393/2007 (1)","Ciencias de la Salud","","Publicado en B.O.E.","(TITULACIÓN EXTINGUIDA)"
"4310711","Máster Universitario en Cognición y Evolución Humana","Universitat de les Illes Balears","Máster - RD 1393/2007 (1)","Artes y Humanidades","","Publicado en B.O.E.","(TITULACIÓN EXTINGUIDA)"
"3000120","Máster Universitario en Cognición y Evolución Humana","Universitat de les Illes Balears","Máster - RD 56/2005 (2)","Ingeniería y Arquitectura","","Autorizado por Comunidad Aut&oacute;noma","(TITULACIÓN EXTINGUIDA)"
"4314264","Máster Universitario en Cognición y Sociedad  por la Universitat de les Illes Balears","Universitat de les Illes Balears","Máster - RD 822/2021 (3)","Ciencias Sociales y Jurídicas","Ciencias del comportamiento y psicología","Publicado en B.O.E.","(TITULACIÓN RENOVADA)"
"3001115","Máster Universitario en Comunicación: Retos de la Comunicación en el Siglo XXI","Universitat de les Illes Balears","Máster - RD 56/2005 (2)","Ingeniería y Arquitectura","","Autorizado por Comunidad Aut&oacute;noma","(TITULACIÓN EXTINGUIDA)"
"4311599","Máster Universitario en Contabilidad","Universitat de les Illes Balears","Máster - RD 1393/2007 (1)","Ciencias Sociales y Jurídicas","","Publicado en B.O.E.","(TITULACIÓN EXTINGUIDA)"
"3001127","Máster Universitario en Contabilidad","Universitat de les Illes Balears","Máster - RD 56/2005 (2)","Ingeniería y Arquitectura","","Autorizado por Comunidad Aut&oacute;noma","(TITULACIÓN EXTINGUIDA)"
"4313603","Máster Universitario en Contabilidad y Auditoría por la Universitat de les Illes Balears","Universitat de les Illes Balears","Máster - RD 822/2021 (3)","Ciencias Sociales y Jurídicas","Ciencias económicas, administración y dirección de empresas, márquetin, comercio, contabilidad y turismo","Publicado en B.O.E.","(TITULACIÓN RENOVADA)"
"3002512","Máster Universitario en De lo Oral a lo Escrito: La lengua y la Literatura Catalanas desde la Perspectiva de la Oralidad","Universitat de les Illes Balears","Máster - RD 56/2005 (2)","Ingeniería y Arquitectura","","Autorizado por Comunidad Aut&oacute;noma","(TITULACIÓN EXTINGUIDA)"
"3001126","Máster Universitario en Dirección y Planificación del Turismo","Universitat de les Illes Balears","Máster - RD 56/2005 (2)","Ingeniería y Arquitectura","","Autorizado por Comunidad Aut&oacute;noma","(TITULACIÓN EXTINGUIDA)"
"4310132","Máster Universitario en Dirección y Planificación del Turismo","Universitat de les Illes Balears","Máster - RD 1393/2007 (1)","Ciencias Sociales y Jurídicas","","Publicado en B.O.E.","(TITULACIÓN EXTINGUIDA)"
"4314960","Máster Universitario en Dirección y Planificación del Turismo por la Universidad de las Illes Balears y la Universidad Pompeu Fabra","(Conjunto)","Máster - RD 1393/2007 (1)","Ciencias Sociales y Jurídicas","","Publicado en B.O.E.","(TITULACIÓN EXTINGUIDA)"
"3001122","Máster Universitario en Ecología Marina","Universitat de les Illes Balears","Máster - RD 56/2005 (2)","Ingeniería y Arquitectura","","Autorizado por Comunidad Aut&oacute;noma","(TITULACIÓN EXTINGUIDA)"
"4310133","Máster Universitario en Ecología Marina","Universitat de les Illes Balears","Máster - RD 1393/2007 (1)","Ciencias","","Publicado en B.O.E.","(TITULACIÓN EXTINGUIDA)"
"4315287","Máster Universitario en Ecología Marina por la Universitat de les Illes Balears","Universitat de les Illes Balears","Máster - RD 822/2021 (3)","Ciencias","Ciencias medioambientales y ecología","Publicado en B.O.E.","(TITULACIÓN RENOVADA)"
"4314959","Máster Universitario en Economía del Turismo: Monitorización y Evaluación por la Universitat de les Illes Balears","Universitat de les Illes Balears","Máster - RD 822/2021 (3)","Ciencias Sociales y Jurídicas","Ciencias económicas, administración y dirección de empresas, márquetin, comercio, contabilidad y turismo","Publicado en B.O.E.","(TITULACIÓN RENOVADA)"
"3000127","Máster Universitario en Economía del Turismo y del Medio Ambiente","Universitat de les Illes Balears","Máster - RD 56/2005 (2)","Ingeniería y Arquitectura","","Autorizado por Comunidad Aut&oacute;noma","(TITULACIÓN EXTINGUIDA)"
"4310134","Máster Universitario en Economía del Turismo y Medio Ambiente","Universitat de les Illes Balears","Máster - RD 1393/2007 (1)","Ciencias Sociales y Jurídicas","","Publicado en B.O.E.","(TITULACIÓN EXTINGUIDA)"
"4317971","Máster Universitario en Edificación y Rehabilitación Arquitectónica por la Universitat de les Illes Balears","Universitat de les Illes Balears","Máster - RD 822/2021 (3)","Ingeniería y Arquitectura","Arquitectura, construcción, edificación y urbanismo, e ingeniería civil","Publicado en B.O.E.",""
"4311268","Máster Universitario en Educación Inclusiva por la Universidad de las Illes Balears; la Universidad de Lleida y la Universidad de Vic-Universidad Central de Catalunya","(Conjunto)","Máster - RD 1393/2007 (1)","Ciencias Sociales y Jurídicas","","Publicado en B.O.E.","(TITULACIÓN EXTINGUIDA)"
"3500795","Máster Universitario en Estudio y Gestión de Ecosistemas Terrestres frente al Cambio Global por la Universitat de les Illes Balears","Universitat de les Illes Balears","Máster - RD 822/2021 (3)","Ciencias","Ciencias medioambientales y ecología","Publicado en B.O.E.",""
"4317180","Máster Universitario en Estudios Lingüísticos y Literarios: Investigación y Enseñanza por la Universitat de les Illes Balears","Universitat de les Illes Balears","Máster - RD 822/2021 (3)","Artes y Humanidades","Filología, estudios clásicos, traducción y lingüística","Publicado en B.O.E.",""
"3500367","Máster Universitario en Estudios Mediterráneos. Patrimonio Cultural, Historia y Arte: Perspectivas Integradas por la Universitat de les Illes Balears","Universitat de les Illes Balears","Máster - RD 822/2021 (3)","Artes y Humanidades","Historia, arqueología, geografía, filosofía y humanidades","Publicado en B.O.E.",""
"3001114","Máster Universitario en Filosofía Contemporánea","Universitat de les Illes Balears","Máster - RD 56/2005 (2)","Ingeniería y Arquitectura","","Autorizado por Comunidad Aut&oacute;noma","(TITULACIÓN EXTINGUIDA)"
"4310710","Máster Universitario en Filosofía Contemporánea","Universitat de les Illes Balears","Máster - RD 1393/2007 (1)","Artes y Humanidades","","Publicado en B.O.E.","(TITULACIÓN EXTINGUIDA)"
"4314199","Máster Universitario en Filosofía por la Universitat de les Illes Balears","Universitat de les Illes Balears","Máster - RD 1393/2007 (1)","Artes y Humanidades","","Publicado en B.O.E.","(TITULACIÓN RENOVADA)"
"4310713","Máster Universitario en Física","Universitat de les Illes Balears","Máster - RD 1393/2007 (1)","Ciencias","","Publicado en B.O.E.","(TITULACIÓN EXTINGUIDA)"
"3000124","Máster Universitario en Física","Universitat de les Illes Balears","Máster - RD 56/2005 (2)","Ingeniería y Arquitectura","","Autorizado por Comunidad Aut&oacute;noma","(TITULACIÓN EXTINGUIDA)"
"4314206","Máster Universitario en Física Avanzada y Matemática Aplicada por la Universitat de les Illes Balears","Universitat de les Illes Balears","Máster - RD 822/2021 (3)","Ciencias","Interdisciplinar","Publicado en B.O.E.","(TITULACIÓN RENOVADA)"
"4313187","Máster Universitario en Física de Sistemas Complejos por la Universidad de las Illes Balears","Universitat de les Illes Balears","Máster - RD 1393/2007 (1)","Ciencias","Física y astronomía","Publicado en B.O.E.","(TITULACIÓN RENOVADA)"
"4311001","Máster Universitario en Formación del Profesorado por la Universitat de les Illes Balears","Universitat de les Illes Balears","Máster - RD 1393/2007 (1)","Ciencias Sociales y Jurídicas","Ciencias de la educación","Publicado en B.O.E.","(TITULACIÓN RENOVADA)"
"4311934","Máster Universitario en Gestión Cultural","(Conjunto)","Máster - RD 1393/2007 (1)","Artes y Humanidades","","Publicado en B.O.E.","(TITULACIÓN EXTINGUIDA)"
"4311600","Máster Universitario en Gestión de Recursos Humanos. Intervención Psicológica y Pedagógica por la Universitat de les Illes Balears","Universitat de les Illes Balears","Máster - RD 822/2021 (3)","Ciencias Sociales y Jurídicas","Ciencias sociales, trabajo social, relaciones laborales y recursos humanos, sociología, ciencia política y relaciones internacionales","Publicado en B.O.E.","(TITULACIÓN RENOVADA)"
"4311312","Máster Universitario en Gestión, Organización y Economía de la Empresa / Management, Organization and Business Economics por la Universidad Autónoma de Barcelona; la Universidad Pública de Navarra y la Universitat de les Illes Balears","(Conjunto)","Máster - RD 1393/2007 (1)","Ciencias Sociales y Jurídicas","Ciencias económicas, administración y dirección de empresas, márquetin, comercio, contabilidad y turismo","Publicado en B.O.E.","(TITULACIÓN RENOVADA POR ACREDITACIÓN INSTITUCIONAL)"
"4315060","Máster Universitario en Ingeniería Agronómica por la Universitat de les Illes Balears","Universitat de les Illes Balears","Máster - RD 822/2021 (3)","Ingeniería y Arquitectura","Ingeniería química, ingeniería de los materiales e ingeniería del medio natural","Publicado en B.O.E.","(TITULACIÓN RENOVADA)"
"4315059","Máster Universitario en Ingeniería de Telecomunicación por la Universidad de las Illes Balears","Universitat de les Illes Balears","Máster - RD 1393/2007 (1)","Ingeniería y Arquitectura","","Publicado en B.O.E.","(TITULACIÓN EXTINGUIDA)"
"3003002","Máster Universitario en Ingeniería Electrónica","(Conjunto)","Máster - RD 56/2005 (2)","Ingeniería y Arquitectura","","Autorizado por Comunidad Aut&oacute;noma","(TITULACIÓN EXTINGUIDA)"
"4310872","Máster Universitario en Ingeniería Electrónica","(Conjunto)","Máster - RD 1393/2007 (1)","Ingeniería y Arquitectura","","Publicado en B.O.E.","(TITULACIÓN EXTINGUIDA)"
"3001120","Máster Universitario en Ingeniería Electrónica","Universitat de les Illes Balears","Máster - RD 56/2005 (2)","Ingeniería y Arquitectura","","Autorizado por Comunidad Aut&oacute;noma","(TITULACIÓN EXTINGUIDA)"
"4314313","Máster Universitario en Ingeniería Industrial por la Universidad de las Illes Balears","Universitat de les Illes Balears","Máster - RD 1393/2007 (1)","Ingeniería y Arquitectura","","Publicado en B.O.E.","(TITULACIÓN A EXTINGUIR)"
"4318247","Máster Universitario en Ingeniería Industrial por la Universitat de les Illes Balears","Universitat de les Illes Balears","Máster - RD 1393/2007 (1)","Ingeniería y Arquitectura","","Publicado en B.O.E.",""
"4314599","Máster Universitario en Ingeniería Informática por la Universidad de las Illes Balears","Universitat de les Illes Balears","Máster - RD 1393/2007 (1)","Ingeniería y Arquitectura","","Publicado en B.O.E.","(TITULACIÓN EXTINGUIDA)"
"4312526","Máster Universitario en Intervención Socioeducativa con Infancia, Adolescencia y Familia por la Universitat de les Illes Balears","Universitat de les Illes Balears","Máster - RD 1393/2007 (1)","Ciencias Sociales y Jurídicas","Ciencias de la educación","Publicado en B.O.E.","(TITULACIÓN RENOVADA)"
"4315836","Máster Universitario en Investigación Biomédica por la Universitat de les Illes Balears","Universitat de les Illes Balears","Máster - RD 1393/2007 (1)","Ciencias de la Salud","Ciencias Biomédicas","Publicado en B.O.E.","(TITULACIÓN RENOVADA)"
"4317736","Máster Universitario en Investigación e Innovación en Salud por la Universitat de les Illes Balears","Universitat de les Illes Balears","Máster - RD 1393/2007 (1)","Ciencias de la Salud","Enfermería","Publicado en B.O.E.",""
"4317705","Máster Universitario en Investigación e Intervención Psicoeducativa por la Universitat de les Illes Balears","Universitat de les Illes Balears","Máster - RD 1393/2007 (1)","Ciencias Sociales y Jurídicas","Ciencias de la educación","Publicado en B.O.E.",""
"4317924","Máster Universitario en Investigación en Ciencias de la Actividad Física y el Deporte por la Universitat de les Illes Balears","Universitat de les Illes Balears","Máster - RD 1393/2007 (1)","Ciencias Sociales y Jurídicas","Actividad física y ciencias del deporte","Publicado en B.O.E.",""
"4314207","Máster Universitario en Investigación en Salud y Calidad de Vida por la Universidad de las Illes Balears","Universitat de les Illes Balears","Máster - RD 1393/2007 (1)","Ciencias de la Salud","","Publicado en B.O.E.","(TITULACIÓN A EXTINGUIR)"
"4314852","Máster Universitario en Lengua y Literatura Catalanas: Conocimiento y Análisis Crítico del Patrimonio Inmaterial por la Universidad de las Illes Balears","Universitat de les Illes Balears","Máster - RD 1393/2007 (1)","Artes y Humanidades","","Publicado en B.O.E.","(TITULACIÓN A EXTINGUIR)"
"4310712","Máster Universitario en Lengua y Literaturas Catalanas: Oralidad y Escritura","Universitat de les Illes Balears","Máster - RD 1393/2007 (1)","Artes y Humanidades","","Publicado en B.O.E.","(TITULACIÓN EXTINGUIDA)"
"4310523","Máster Universitario en Lenguas y Literaturas Modernas por la Universitat de les Illes Balears","Universitat de les Illes Balears","Máster - RD 822/2021 (3)","Artes y Humanidades","Filología, estudios clásicos, traducción y lingüística","Publicado en B.O.E.","(TITULACIÓN RENOVADA)"
