PK;NOMBRE;DESCRIPCION-ENTIDAD;HORARIO;EQUIPAMIENTO;TRANSPORTE;DESCRIPCION;ACCESIBILIDAD;CONTENT-URL;NOMBRE-VIA;CLASE-VIAL;TIPO-NUM;NUM;PLANTA;PUERTA;ESCALERAS;ORIENTACION;LOCALIDAD;PROVINCIA;CODIGO-POSTAL;COD-BARRIO;BARRIO;COD-DISTRITO;DISTRITO;COORDENADA-X;COORDENADA-Y;LATITUD;LONGITUD;TELEFONO;FAX;EMAIL;TIPO
5994605;"Parque de Arriaga";"El Parque de Arriaga está situado a lo largo de la calle de Arriaga frente al cementerio municipal Nuestra Señora de la Almudena, del que le separa la avenida de Daroca. Muchas calles del entorno (y el propio barrio, barrio de Bilbao) poseen nombres vascos debido a que una adinerada familia vizcaína se instaló en la zona. Su diseño, sobre el relieve en talud que vierte hacia ésta avenida combina amplios paseos y zonas estanciales, áreas de césped, arbustos y espacios arbolados, ofreciendo un entorno acogedor para los visitantes. Las especies arboreas que lo pueblan son, entre otras, pino piñonero, olmo, plátano de sombra, cedro, almez, arce, melia y liquidámbar. El parque cuenta con diversas instalaciones deportivas, como pistas de baloncesto y fútbol, así como un área de calistenia para los amantes del ejercicio al aire libre. Además, dispone de varias zonas de juegos infantiles. Un elemento distintivo del parque es su gran estanque circular con fuente, ubicado en uno de los laterales. El Parque de Arriaga y sus instalaciones lo convierten en un punto de encuentro popular para residentes y visitantes.";"";"Zonas infantiles Instalaciones deportivas";"Bus: 106 , 109  Servicio Bicimad, para consultar la estación más cercana, acceda al mapa de geolocalización de las estaciones.";"Conservación: Dirección General de Gestión del Agua y Zonas Verdes, Área de Gobierno de Medio Ambiente y Movilidad.  Superficie: Área de 52.896 m&amp;sup2;.  Vegetación predominante:    Ejemplares arbóreos: Pino piñonero (Pinus pinea), olmo común (Ulmus minor), arce (Acer spp.) y pino carrasco (Pinus halepensis).  Arbustos: Tuya oriental (Thuja orientalis), agracejo (Berberis spp.) y evónimo (Euonymus spp.).  Macizos arbustivos: Espino de fuego (Pyracantha coccinea), pitosporo (Pittosporum spp.) y bambú dorado (Phyllostachys aurea).";"2";"http://www.madrid.es/sites/v/index.jsp?vgnextchannel=bfa48ab43d6bb410VgnVCM100000171f5a0aRCRD&vgnextoid=964f0583e29be210VgnVCM1000000b205a0aRCRD";"DAROCA";"AVENIDA";"V";"95";"";"";"";"";"MADRID";"MADRID";"28017";"2";"PUEBLO NUEVO";"15";"CIUDAD LINEAL";"445479";"4475138";"40.425090271008656";"-3.6427216652412877";"";"";"";"/contenido/entidadesYorganismos/ParquesJardines"
6009741;"Parque de Atenas";"El Parque de Atenas es uno de los más grandes del distrito Centro. Ubicado muy cerca del Palacio Real, está dividido en dos partes por el paseo de la Ciudad de Plasencia. Limita al norte con los Jardines del Campo del Moro, titularidad de Patrimonio Nacional, al sur con la calle de Segovia, al este con la Cuesta de la Vega y al oeste con el paseo de la Virgen del Puerto. Se puede acceder por la mayor parte de su perímetro.  En su mitad norte se encuentran un pequeño estanque con cuatro chorros verticales y también zonas deportivas e infantiles. La parte sur se conforma a base de numerosos caminos pavimentados y terrizos.  En todo el parque existen zonas de pradera. Es un espacio con gran diversidad vegetal: acacias del Japón, acacias de tres espinas, castaños de Indias y olmos, entre otros. Algunos de los grandes pinos piñoneros existentes tienen anclajes subterráneos para conferirles estabilidad. En 2022 se instaló un área de calistenia.  Aunque ya en 1848  el Ayuntamiento decidió convertirlo en un bosquete de árboles y arbustos, fue en 1971 cuando se creó el parque tal y como se conforma hoy.  Su denominación rinde honor a la ciudad donde nació la reina doña Sofía. El parque está incluido en el Catálogo de Parques Históricos y Jardines de Interés con nivel 2.";"";"Zonas infantiles Instalaciones deportivas - Aseos públicos";"Bus: 3 , 31 , 41 , 50 , 65 , 148 , C1 , L3   Servicio Bicimad, para consultar la estación más cercana, acceda al mapa de geolocalización de las estaciones.";"Conservación:  Dirección General de Gestión del Agua y Zonas Verdes, Área de Gobierno de Medio Ambiente y Movilidad.   Superficie: 4,62 hectáreas.  Vegetación predominante:    Ejemplares arbóreos: acacia del Japón (Styphnolobium japonicum), acacia de tres espinas (Gleditsia triacanthos), castaño de Indias (Aesculus hippocastanum) y olmo de Siberia (Ulmus pumila).  Arbustos: hortensia de hoja de roble (Hydrangea quercifolia), adelfa (Nerium oleander) y tuya occidental (Thuja occidentalis).  Macizos arbustivos: junípero horizontal (Juniperus horizontalis), piracantas (Pyracantha spp.) y berberis (Berberis spp.).";"2";"http://www.madrid.es/sites/v/index.jsp?vgnextchannel=bfa48ab43d6bb410VgnVCM100000171f5a0aRCRD&vgnextoid=e4de4bc5292ee210VgnVCM2000000c205a0aRCRD";"SEGOVIA";"CALLE";"V";"28";"";"";"";"";"MADRID";"MADRID";"28005";"1";"PALACIO";"1";"CENTRO";"439327";"4473951";"40.413971277014085";"-3.715138075489171";"";"";"";"/contenido/entidadesYorganismos/ParquesJardines"
5969105;"Parque de Berlín";"El Parque de Berlín es un parque urbano delimitado por las calles Ramón y Cajal, Marcenado y San Ernesto. Este espacio verde cuenta con diferentes áreas de pradera y arboladas, interconectadas por paseos sinuosos, y está adornado con varias fuentes ornamentales. Además, incluye esculturas, zonas de juegos infantiles, un área canina, y pistas de fútbol y baloncesto. El parque también alberga un bar-cafetería con terraza, así como una zona con mesas de picnic y juegos. Entre sus características destacadas, se encuentra un pequeño escenario, ideal para eventos, un busto dedicado a Álvaro Iglesias Sánchez, el heroico joven de 20 años que falleció tras librar de la muerte a varias personas en el incendio de un inmueble en la calle Carranza, y un estanque de sobre un basamento de granito en el que se sustentan restos significativos del Muro de Berlín, una escultura de un oso, símbolo de la ciudad de Berlín, y un monumento en homenaje a Beethoven.  Es un lugar donde se realizan eventos de forma periódica y que es disfrutado por todo el vecindario.";"";"Zonas infantiles Zonas adulto mayor Zonas caninas Zonas deportivas Auditorios Aseo público Senda botánica";"Metro: Concha Espina (línea 9) Bus: 16, 29, 43, 52 y 120  Servicio Bicimad, para consultar la estación más cercana, acceda al mapa de geolocalización de las estaciones.";"Conservación: Dirección General de Gestión del Agua y Zonas Verdes, Área de Gobierno de Medio Ambiente y Movilidad.  Superficie: 4,91 hectáreas.  Vegetación predominante:    Ejemplares arbóreos: castaño de Indias (Aesculus hippocastanum), plátano de sombra (Platanus x hispanica), álamo plateado (Populus alba) y ciruelo rojo (Prunus cerasifera).  Arbustos: acebo (Ilex aquifolium), espino de fuego (Pyracantha coccinea) y rosa de Siria (Hibiscus syriacus).  Macizos arbustivos: adelfa (Nerium oleander), vinca (Vinca spp.) y rosas (Rosa spp.).";"1";"http://www.madrid.es/sites/v/index.jsp?vgnextchannel=bfa48ab43d6bb410VgnVCM100000171f5a0aRCRD&vgnextoid=d2e70e165684e210VgnVCM1000000b205a0aRCRD";"RAMON Y CAJAL";"AVENIDA";"V";"2";"";"";"";"";"MADRID";"MADRID";"28016";"3";"CIUDAD JARDIN";"5";"CHAMARTIN";"442673";"4478091";"40.45150372849227";"-3.6760645355093797";"";"";"";"/contenido/entidadesYorganismos/ParquesJardines"
6010393;"Parque de Breogán";"El Parque de Breogán, mítico rey Galaico, es un parque delimitado por la Avenida de Brasilia y la M-30, que se caracteriza por amplias áreas terrizas, bosquetes de pinos y alineaciones de ciruelos, además de tilos, álamos, cedros y diferentes macizos arbustivos. Este espacio también alberga zonas infantiles de arena, así como pistas de fútbol y baloncesto, destinadas al esparcimiento de los usuarios. Además, el parque cuenta con amplias praderas y, limitando con la M-30, presenta macizos de adelfas y rosales que embellecen el entorno. Como aspectos singulares, se aprecian elementos ornamentales como un cruceiro de piedra y un monolito de granito con un poema de Alfonso Rodríguez Castelao, que dice: &amp;ldquo;Galicia e a mellor esquina do solar hispanico cabo do mondo antigo e avanzada de Europa no mar inmenso da liberdade&amp;rdquo; Sempre en Galiza, 23 de mayo de 1982.";"";"Zonas infantiles Zonas deportivas";"Metro: Parque Avenidas (línea 7) Bus: 21, 43, 48 , 53 y 74  Servicio Bicimad, para consultar la estación más cercana, acceda al mapa de geolocalización de las estaciones.";"Conservación: Dirección General de Gestión del Agua y Zonas Verdes, Área de Gobierno de Medio Ambiente y Movilidad.  Superficie: 2,23 hectáreas.  Vegetación predominante:    Ejemplares arbóreos: pino piñonero (Pinus pinea), álamo plateado (Populus alba), ciruelo rojo (Prunus cerasifera) y cedro del Atlas (Cedrus atlantica).  Macizos arbustivos: rosas (Rosa spp.), adelfa (Nerium oleander) y hiedra (Hedera spp.).";"2";"http://www.madrid.es/sites/v/index.jsp?vgnextchannel=bfa48ab43d6bb410VgnVCM100000171f5a0aRCRD&vgnextoid=05d3a3575e2ee210VgnVCM2000000c205a0aRCRD";"BRASILIA";"AVENIDA";"V";"2";"";"";"";"";"MADRID";"MADRID";"28028";"4";"GUINDALERA";"4";"SALAMANCA";"443948";"4476487";"40.437140971249754";"-3.6608995093418306";"";"";"";"/contenido/entidadesYorganismos/ParquesJardines"
5984659;"Parque de Canillejas";"Situado en el centro del barrio de Canillejas, cuenta con dos áreas infantiles y una gran explanada donde se ubica un auditorio al aire libre. Los paseos perimetrales se encuentran resguardados por unas pérgolas con plantas trepadoras. En el lateral que da a la C/ San Mariano se encuentra un monumento en homenaje al matador de toros José Cubero 'Yiyo', que fue vecino del barrio. La zona infantil de mayor tamaño está rodeada de praderas y en los terrizos cercanos al auditorio se ha instalado un circuito biosaludable para uso vecinal.";"";"Zonas infantiles Zonas de mayores Zonas caninas Instalaciones deportivas Auditorios Monumentos";"Bus: 28, 48   Servicio Bicimad, para consultar la estación más cercana, acceda al mapa de geolocalización de las estaciones.";"Conservación: Dirección General de Gestión del Agua y Zonas Verdes. Área de Gobierno de Medio Ambiente y Movilidad   Superficie: 11.237 m&amp;sup2;   % Especies predominantes (nombre común) con respecto a especies principales:Árboles. N&amp;ordm; total de unidades arbóreas: 178Pino piñonero 47%Acacia del Japón 38Plátano de sombra 6%Olmo 4% Arbustos. N&amp;ordm; total de unidades arbustivas: 4Agracejo 75% Macizos arbustivos. Superficie de macizos arbustivos: 1.393 m&amp;sup2; Adelfa 21%Espirea 14%";"2";"http://www.madrid.es/sites/v/index.jsp?vgnextchannel=bfa48ab43d6bb410VgnVCM100000171f5a0aRCRD&vgnextoid=0da848147809e210VgnVCM2000000c205a0aRCRD";"CIRCE";"CALLE";"V";"57";"";"";"";"";"MADRID";"MADRID";"28022";"7";"CANILLEJAS";"20";"SAN BLAS-CANILLEJAS";"448198";"4476986";"40.44191186628217";"-3.610832880429799";"";"";"";"/contenido/entidadesYorganismos/ParquesJardines"
5986854;"Parque de Comillas";"CERRADO TEMPORALMENTE POR AFECCIÓN DE LAS OBRAS DE LA LÍNEA 11 DEL METRO";"";"Zonas infantiles Zonas de mayores Zonas caninas Instalaciones deportivas";"Bus: 55, 60 y 116  Servicio Bicimad, para consultar la estación más cercana, acceda al mapa de geolocalización de las estaciones.";"Conservación: Dirección General de Gestión del Agua y Zonas Verdes. Área de Gobierno de Medio Ambiente y Movilidad   Superficie: 35.337 m2    % Especies predominantes (nombre común) con respecto a especies principales:Árboles. N&amp;ordm; total de unidades arbóreas: 498Pino piñonero 31%Plátano de sombra 22%Acacia del Japón %9Falsa acacia 7% Arbustos. N&amp;ordm; total de unidades arbustivas: 5Arbusto de las mariposas 80%Adelfa 20% Macizos arbustivos. Superficie de macizos arbustivos:3.396 m2  Adelfa 26%Agracejo 19%Pitosporo 14%";"2";"http://www.madrid.es/sites/v/index.jsp?vgnextchannel=bfa48ab43d6bb410VgnVCM100000171f5a0aRCRD&vgnextoid=353f07ea5d99e210VgnVCM2000000c205a0aRCRD";"MIGUEL SORIANO";"CALLE";"V";"1";"";"";"";"";"MADRID";"MADRID";"28019";"1";"COMILLAS";"11";"CARABANCHEL";"439391";"4471503";"40.39191419121823";"-3.7141505979369023";"";"";"";"/contenido/entidadesYorganismos/ParquesJardines"
5981170;"Parque de Darwin";"Zona verde formada por plazas terrizas con plantaciones diversas. En la parte más próxima a la calle Julia García Boutan existe una zona interbloque formada por parterres de césped rodeados por seto de aligustre.";"";"Zonas infantiles Zonas de mayores Zonas caninas Instalaciones deportivas";"Bus: 8, 20 y 113.   Servicio Bicimad, para consultar la estación más cercana, acceda al mapa de geolocalización de las estaciones.";"Conservación: Dirección General de Gestión del Agua y Zonas Verdes. Área de Gobierno de Medio Ambiente y Movilidad   Superficie: 41.123 m2    % Especies predominantes (nombre común) con respecto a especies principales:Árboles. N&amp;ordm; total de unidades arbóreas: 955Tuya oriental 10%Pino piñonero 12%Arce negundo 8%Olmo de Siberia 11% Arbustos. N&amp;ordm; total de unidades arbustivas: 18Espino de fuego 44%Lavanda 11%Mahonia 11% Macizos arbustivos. Superficie de macizos arbustivos: 15.208 m2  Rosa 100%Adelfa 14%Enebro rastrero 10%";"2";"http://www.madrid.es/sites/v/index.jsp?vgnextchannel=bfa48ab43d6bb410VgnVCM100000171f5a0aRCRD&vgnextoid=7aedfbb16c67e210VgnVCM1000000b205a0aRCRD";"MANUEL MARIA ARRILLAGA";"CALLE";"V";"29";"";"B";"";"";"MADRID";"MADRID";"28030";"5";"FONTARRON";"14";"MORATALAZ";"443926";"4473129";"40.40687979108534";"-3.660862691056585";"";"";"";"/contenido/entidadesYorganismos/ParquesJardines"
5963981;"Parque de Enrique Herreros";"El Parque de Enrique Herreros es un espacio delimitado que se encuentra en la confluencia de las calles Cea Bermúdez y Bravo Murillo. Este parque cuenta con un amplio paseo y una zona estancial rodeada de vegetación. Tiene forma cuadrangular y, aunque de tamaño reducido, alberga diferentes servicios, como una zona infantil, una zona de petanca y pistas deportivas de pádel. El paseo principal que lo atraviesa está pavimentado. Aparece como elemento ornamental una fuente situada en la plaza central. Un poco más al oeste de esta se halla otra pequeña plaza circular con elementos vegetales. Cerca de la zona infantil hay un busto del personaje que da nombre al parque, Enrique Herreros. Los árboles más frecuentes son el ciruelo rojo, árbol del amor, plátano de sombra, castaño de Indias y diferentes arbustos.  Historia del parque  Enrique Herreros (1903 - 1977), hombre polifacético, estudió arquitectura industrial, y destacó por su labor como dibujante, siendo autor de numerosas portadas en la revista de humor gráfico La Codorniz. Vecino del barrio de Malasaña, fue nombrado hijo predilecto de Madrid a título póstumo. El parque se inauguró el 30 de diciembre de 1993. En el año 2020 se realizaron obras de mejora en el espacio, ampliando la zona canina, mejorando los caminos y potenciando el templete/mirador.";"De 8 a 22 horas";"Zonas infantiles Zonas de mayores Zonas caninas Instalaciones deportivas";"Metro: Canal (líneas 2, 7) Bus: 3 , 12 , 37 , 149  Servicio Bicimad, para consultar la estación más cercana, acceda al mapa de geolocalización de las estaciones.";"Conservación: Dirección General de Gestión del Agua y Zonas Verdes. Área de Gobierno de Medio Ambiente y Movilidad   Superficie: 6.667 m2     Vegetación predominante:      Ejemplares arbóreos: ciruelo rojo (Prunus cerasifera var. pissardii), árbol del amor (Cercis siliquastrum), castaño de Indias (Aesculus hippocastanum), plátano de sombra (Platanus hispanica)     Arbustos: madreselva (Lonicera periclymenum), plumero (Cortaderia selloana), laurel (Laurus nobilis)     Macizos arbustivos: enebro rastrero (Juniperus horizontalis), piracanta (Pyracantha coccinea), rosal silvestre (Rosa canina)";"2";"http://www.madrid.es/sites/v/index.jsp?vgnextchannel=bfa48ab43d6bb410VgnVCM100000171f5a0aRCRD&vgnextoid=5d89b70bfbe2e210VgnVCM2000000c205a0aRCRD";"BRAVO MURILLO";"CALLE";"V";"49";"";"";"";"";"MADRID";"MADRID";"28003";"6";"VALLEHERMOSO";"7";"CHAMBERI";"440261";"4476761";"40.43934359051524";"-3.7043941647283263";"";"";"";"/contenido/entidadesYorganismos/ParquesJardines"
5993103;"Parque de Francos Rodríguez";"Esta superficie de conformación triangular se conoce también por el nombre de Parque de Ofelia Nieto. Está limitado por la calle del Arquitecto Sánchez Arcas y las avenidas de las Moreras y del Doctor Federico Rubio y Galí. La parte más alta se encuentra junto a esta última calle, descendiendo suavemente a medida que se aproxima a la CIudad Universitaria. El parque está formado por paseos curvos de pavimento duro que lo atraviesan dando lugar a distintos accesos. Existen zonas más anchas de terrizo donde hay diferentes areas infantiles. En el lado norte nace una ría que atraviesa el parque, que puede cruzarse por un pequeño puente de madera que se sitúa en la parte central y da acceso a unas escaleras. La superficie, a excepción de la zona de terrizo, está cubierta de césped y algunos macizos arbustivos. EL arbolado acompañante es diverso: pinos piñoneros, cedros, arces, chopos, manzanos, etc. Se trata de una zona verde con medio siglo de antig&amp;uuml;edad, que se construyó con el desarrollo de la zona, al abrirse el Camino de las Moreras a través de suelo baldío, huertas y viejas edificaciones. Se sitúa muy próxima a la Escuela Técnica Superior de Ingenieros de Montes, Forestal y del Medio Natural. Además, se encuentra en una zona que formaba parte del Canalillo, una infraestructura hidráulica construida en el siglo XIX para evacuar los caudales de agua excedentes del Canal de Isabel II (CYII). Este canal, que atravesaba todo Madrid, desempeñó un papel crucial en la gestión del agua en la ciudad, permitiendo el drenaje de aguas pluviales y evitando inundaciones en las áreas urbanas.";"";"Zonas infantiles Aparcamientos de bicicletas";"Bus: 132, 44 Metro: Francos Rodríguez (línea 7)  Servicio Bicimad, para consultar la estación más cercana, acceda al mapa de geolocalización de las estaciones.";"Conservación:Dirección General de Gestión del Agua y Zonas Verdes. Área de Gobierno de Medio Ambiente y Movilidad   Superficie: 26.407 m&amp;sup2;   Vegetación predominante:     Árboles: pino piñonero (Pinus pinea), arce (Acer spp.), plátano de sombra (Platanus hispanica), catalpa (Catalpa bignonioides), cedros (Cedrus spp.).  Arbustos: Berberis (Berberis spp.), Griñolera (Nandina domestica), Cotoneaster (Cotoneaster spp.)  Macizos arbustivos: cotoneaster (Cotoneaster spp.), Mahonia (Mahonia spp.), enebro (Juniperus spp.)";"2";"http://www.madrid.es/sites/v/index.jsp?vgnextchannel=bfa48ab43d6bb410VgnVCM100000171f5a0aRCRD&vgnextoid=4bafb863b84be210VgnVCM1000000b205a0aRCRD";"DOCTOR FEDERICO RUBIO Y GALI";"AVENIDA";"V";"63";"";"";"";"";"MADRID";"MADRID";"28040";"3";"CIUDAD UNIVERSITARIA";"9";"MONCLOA-ARAVACA";"439443";"4478366";"40.45374298443811";"-3.714179732136829";"";"";"";"/contenido/entidadesYorganismos/ParquesJardines"
5995881;"Parque de Fuencarral";"Este parque popularmente conocido -al menos en una parte- como 'Parque de los Enamorados', está situado en el barrio de Valverde, al norte del casco del antiguo pueblo de Fuencarral, entre las calles Afueras de Valverde hacia el este, Nuestra Señora de Valverde al sur y el Barrio de Tres Olivos en su límite oeste y norte.  El parque se desarrolla sobre una zona ocupada desde las primeras décadas del siglo XX por una cubierta vegetal formada por pinos, sobre los terrenos en los que se levantaba el antiguo lavadero municipal del pueblo, que estuvo en uso hasta los años 70. En 1977 se conformó el parque tal y como lo conocemos ahora, gracias a una actuación de remodelación del entorno y fue inaugurado el 26 de abril de 1978 por el entonces alcalde José Luis Álvarez. En el parque, de relieve plano con ondulaciones, predominan amplias praderas naturales con arbolado consolidado que se dispone acompañadondo el trazado de sus caminos pavimentados en adoquín. Al sur, aparecen plantaciones arbustivas, una zona terriza con pinos de gran porte y un muro ajardinado que salva el desnivel existente entre la zona verde y la calle Afueras a Valcerde. Al norte, dentro de la superficie verde y perfectamente imbricado en el entorno, se sitúa el Huerto Urbano Fuente de la Carra, cuya entidad responsable es 'HORENCO, hortelanos en comunidad'.";"";"Zonas infantiles Zonas de mayores Instalaciones deportivas Templete";"Bus: 66, 137  Servicio Bicimad, para consultar la estación más cercana, acceda al mapa de geolocalización de las estaciones.";"Conservación: Dirección General de Gestión del Agua y Zonas Verdes, Área de Gobierno de Medio Ambiente y Movilidad.   Superficie: Área de 21.677 m&amp;sup2;.  Vegetación predominante:   Ejemplares arbóreos: Pino piñonero (Pinus pinea), acacia del Japón (Sophora japonica), acacia de tres espinas (Gleditsia triacanthos), cedro llorón (Cedrus deodara) y olmo siberiano (Ulmus pumila).  Macizos arbustivos: Griñolera (Cotoneaster horizontalis), adelfa (Nerium oleander), fotinia (Photinia spp.) y espino de fuego (Pyracantha coccinea).";"2";"http://www.madrid.es/sites/v/index.jsp?vgnextchannel=bfa48ab43d6bb410VgnVCM100000171f5a0aRCRD&vgnextoid=be479bd14bdbe210VgnVCM2000000c205a0aRCRD";"NUESTRA SEÑORA DE VALVERDE";"CALLE";"V";"151";"";"";"";"";"MADRID";"MADRID";"28034";"6";"VALVERDE";"8";"FUENCARRAL-EL PARDO";"441863";"4483506";"40.50021894773631";"-3.6861244200250765";"";"";"";"/contenido/entidadesYorganismos/ParquesJardines"
5996408;"Parque de Fuentechica";"El Parque de Fuentechica es una modesta zona verde con un alto nivel de tránsito, ubicada cerca de la estación de metro de Fuencarral. Destaca por su variado y frondoso arbolado de gran altura, que ofrece sombra en sus espacios y paseos. Además, cuenta con una zona de juegos infantiles, convirtiéndose en un lugar ideal para hacer una pausa y desconectar del bullicio urbano. Su construcción se realiza en el año 1993, aprovechándose para su diseño la red de caminos espontáneos que se perfilaban sobre la parcela primigenia. En el seno del parque destacan dos esculturas conceptuales o abstractas. Una es la denominada 'Homenaje a Miró' y la segunda 'Princesa de Yaiza'.";"";"";"Bus: 66, 137   Servicio Bicimad, para consultar la estación más cercana, acceda al mapa de geolocalización de las estaciones.";"Conservación: Dirección General de Gestión del Agua y Zonas Verdes. Área de Gobierno de Medio Ambiente y Movilidad.   Superficie: 20.350 m&amp;sup2;  Vegetación predominante:     Ejemplares arbóreos: falsa acacia (Robinia pseudoacacia), olmo de Siberia ( Ulmus pumila ), p látano de sombra ( Platanus x hispanica ), ciruelo rojo (Prunus cerasifera).    Arbustos: adelfa (Nerium oleander), abutillón (Abutilon pictum), gayomba (Spartium junceum).    Macizos arbustivos: romero ( Salvia rosmarinus ), laurentino (Viburnum tinus), adelfa (Nerium oleander).";"2";"http://www.madrid.es/sites/v/index.jsp?vgnextchannel=bfa48ab43d6bb410VgnVCM100000171f5a0aRCRD&vgnextoid=b35ca307b6ebe210VgnVCM2000000c205a0aRCRD";"ANASTASIA LOPEZ";"CALLE";"V";"21";"";"";"";"";"MADRID";"MADRID";"28034";"6";"VALVERDE";"8";"FUENCARRAL-EL PARDO";"441401";"4483010";"40.49571829898632";"-3.6915305267345935";"";"";"";"/contenido/entidadesYorganismos/ParquesJardines"
5996070;"Parque de Fuentelarreina";"Parque con pinos y chopos de buen tamaño sobre praderas naturales. Dispone de zona infantil y zona deportiva.";"";"Zonas infantiles";"Bus: 67, 82  Servicio Bicimad, para consultar la estación más cercana, acceda al mapa de geolocalización de las estaciones.";"Conservación: Dirección General de Gestión del Agua y Zonas Verdes. Área de Gobierno de Medio Ambiente y Movilidad.   Superficie: 43.963 m2    Especies predominantes (  %   con respecto a especies principales)   Árboles. N&amp;ordm; total de unidades arbóreas: 457Álamo plateado 30Plátano de sombra 13Olmo de Siberia 11Pino piñonero 10 Macizos arbustivos. Superficie de macizos arbustivos: 4.029 m&amp;sup2; Pitosporo 24Griñolera 27Piracanta de hoja estrecha 48";"2";"http://www.madrid.es/sites/v/index.jsp?vgnextchannel=bfa48ab43d6bb410VgnVCM100000171f5a0aRCRD&vgnextoid=1ad736fa8ddbe210VgnVCM2000000c205a0aRCRD";"ROSALIA DE CASTRO";"CALLE";"V";"80";"";"";"";"";"MADRID";"MADRID";"28035";"3";"PEÑA GRANDE";"8";"FUENCARRAL-EL PARDO";"437809";"4481678";"40.48346692636297";"-3.7337736098964642";"";"";"";"/contenido/entidadesYorganismos/ParquesJardines"
