PK;NOMBRE;DESCRIPCION-ENTIDAD;HORARIO;EQUIPAMIENTO;TRANSPORTE;DESCRIPCION;ACCESIBILIDAD;CONTENT-URL;NOMBRE-VIA;CLASE-VIAL;TIPO-NUM;NUM;PLANTA;PUERTA;ESCALERAS;ORIENTACION;LOCALIDAD;PROVINCIA;CODIGO-POSTAL;COD-BARRIO;BARRIO;COD-DISTRITO;DISTRITO;COORDENADA-X;COORDENADA-Y;LATITUD;LONGITUD;TELEFONO;FAX;EMAIL;TIPO
12724992;"Centro Deportivo Municipal Cuatro Caminos";"";"Horario de uso de las instalaciones deportivas   De lunes a viernes de 7 a 23 horas, sábados, domingos y festivos de 7 a 24 horas.   Horario taquilla    De lunes a viernes de 7 a 23 horas, sábados, domingos y festivos de 07 a 24 horas.    Cierre completo del centro    Días 25 de diciembre, 1 de enero y 1 de mayo.";"Clases y escuelas deportivas    Pre-infantiles (0 a 3 años) y de (3 a 5 años): matronatación, natación peques.  Infantiles (de 6 a 14 años): natación, calistenia y baile K-Pop. Polideportiva (Family gym, Gym Kid y Play Kid)   Jóvenes y personas adultas  (De 15 a 26 años): aeróbic (zumba, dance), ciclo sala, fitness (body combat) tonificación (body pump), gimnasia suave (body balance, Pilates, Yoga, fuerza general (Total Training), gimnasia acuática (aquafit) y Escuelas deportivas natación. Actividades de sala (Bootcamp Ceremony, Calistenia, CrossTraining, Fuerza+HBX, Myrox, Pilates Club, Pilates Implementos, Pilates Reformer, Yoga Club, Yoga Vinyasa).       (De 21 a 64 años): aeróbic (zumba, dance), ciclo sala, fitness (body combat) tonificación (body pump), gimnasia suave (body balance, Pilates, Yoga, fuerza general (Total Training), gimnasia acuática (aquafit) y Escuelas deportivas natación. Actividades de sala (Bootcamp Ceremony, Calistenia, CrossTraining, Fuerza+HBX, Myrox, Pilates Club, Pilates Implementos, Pilates Reformer, Yoga Club, Yoga Vinyasa).     Mayores 65 años: acondicionamiento físico (Gimnasia activa, movilidad activa) y gimnasia acuática (aquagym y aquapilates), escuela de natación.  Actividades para personas con discapacidad: natación.   Equipamientos    Superficie total de las instalaciones: 9.200 metros cuadrados.  Unidades deportivas cubiertas:  piscina (vaso de 25 metros y vaso de enseñanza), sala fitness, 5 salas multiusos, zona termal (spa, sauna y baño de vapor).   Unidades deportivas al aire libre: 2 terrazas multiusos.  Otros equipamientos:  zona de fisioterapia.    Ayudas técnicas para la accesibilidad:  ascensor y grúa móvil piscina.";"Metro: Cuatro Caminos (líneas 1, 2 y 7), Guzmán el Bueno (Líneas 6 y 7) Islas Filipinas (Línea 7), Alvarado (Línea 1) Canal (Líneas 2 y 7).  Bus: Circular 1 y 2, líneas 3, 37. 45, 64, 66, 124, 127, 128, 149 y N23.  Bicicleta:   Servicio Bicimad: Estación 132 de calle Santa Engracia 168 y estación 204 de calle Doctor Santero 1.para consultar la estación más cercana, acceda al mapa de geolocalización de las estaciones.";"";"2,4";"http://www.madrid.es/sites/v/index.jsp?vgnextchannel=bfa48ab43d6bb410VgnVCM100000171f5a0aRCRD&vgnextoid=5184a4ba934a5910VgnVCM1000001d4a900aRCRD";"BRAVO MURILLO";"CALLE";"V";"107";"";"";"";"";"MADRID";"MADRID";"28020";"1";"BELLAS VISTAS";"6";"TETUAN";"440298";"4477714";"40.44793969377676";"-3.7040303744815635";"91 117 71 07";"";"info@sportrade.es";"/contenido/entidadesYorganismos/CentrosEspaciosDeporte/Gimnasios"
134059;"Centro Deportivo Municipal Daoíz y Velarde 1";"";"Horario de uso de las instalaciones deportivas    Para saber el horario de apertura de las distintas instalaciones del centro deportivo, les rogamos lo consulten con el propio centro.  Horario de taquilla    De lunes a viernes de 9 a 20,30 horas. Sábados, domingos y festivos de 9 a 14,30 horas.   Cierre completo del centro     Mes de agosto y los días 24, 25 y 31 de diciembre, 1 de enero y 1 de mayo.";"Clases y escuelas deportivas     Pre-infantiles: (de 0 a 3 años): matronatación y natación.  Infantiles (edad, según modalidades): badminton, baloncesto, natación, natación sincronizada,  polideportiva y salvamento acuático.  Jóvenes y personas adultas: carrera acuática (acuarunning), ciclo sala, fitness, gimnasia acuática  (acuagim), gimnasia de compensación, natación, natación de compensación, natación embarazada, pilates/estiramientos y tonificación.  Mayores 65 años: acondicionamiento físico, gimnasia acuática (acuagim), natación y pilates.  Personas con discapacidad intelectual: baloncesto.   Equipamientos    Superficie total de las instalaciones: 9.496 metros cuadrados.  Unidades deportivas al aire libre: 1 pista de pádel (cristal).  Unidades deportivas cubiertas: 1 pabellón polideportivo, 1 piscina (vaso de 25 m. y vaso de enseñanza), 1 sala ciclo, 2 salas multiusos, 1 sala de musculación, y 1 sala de fisioterapia/hidroterapia (fuera de servicio).  Oficina de promoción deportiva: responsable de la coordinación de Juegos Deportivos Municipales, Torneos y Circuitos Municipales, Copas de Primavera. Además, ofrece información sobre las escuelas de promoción deportiva.   Servicio de Medicina Deportiva: acondicionamiento cardiovascular, fisioterapia deportiva, reconocimientos médicos deportivos y servicio de fisioterapia.  Ayudas técnicas para la accesibilidad: 1 ascensor y 1 grúa de piscina.  C olumna de rescate cardíaco.";"Metro: Pacífico, Menéndez Pelayo Bus: 37, 57, 10, 54, 24, 141  Renfe: Méndez Alvaro, Atocha  Bicicleta: el centro dispone de aparcabicicletas exterior con capacidad para 5 bicicletas.   Servicio Bicimad, para consultar la estación más cercana, acceda al mapa de geolocalización de las estaciones.";"";"1,5,6";"http://www.madrid.es/sites/v/index.jsp?vgnextchannel=bfa48ab43d6bb410VgnVCM100000171f5a0aRCRD&vgnextoid=380d5f463b81c010VgnVCM1000000b205a0aRCRD";"DAOÍZ Y VELARDE";"PLAZA";"V";"5";"";"";"";"";"MADRID";"MADRID";"28007";"1";"PACIFICO";"3";"RETIRO";"442528";"4472638";"40.40236990974131";"-3.6772808932293217";"914 338 950                                                                                  
914 338 770";"";"idmdvelarde@madrid.es";"/contenido/entidadesYorganismos/CentrosEspaciosDeporte/Gimnasios"
4726;"Centro Deportivo Municipal Daoíz y Velarde 2";"";"Horario de uso de instalaciones deportivas   Para saber el horario de apertura de las distintas instalaciones del centro deportivo, les rogamos lo consulten con el propio centro.  Horario de taquilla   De lunes a viernes; de 9 a 21 horas.   Cierre completo del centro   Sábados, domingos y festivos. Mes de agosto.";"Clases y escuelas deportivas    Infantiles (de 5 a 16 años, según modalidades): aeróbic, gimnasia rítmica y karate.  Jóvenes y personas adultas: acondicionamiento físico deportivo, aeróbic (zumba , zumba step), baile (bollywood, bailes latinos, lady style y bailes de salón), defensa personal, karate, musculación, pilates, tai chi y yoga.  Mayores de 65 años: pilates, tai chi y yoga.   Equipamientos    Superficie total de las instalaciones: 9.420 metros cuadrados.  Unidades deportivas cubiertas: sala gimnasio, 2 salas de artes marciales, 2 salas multiusos y 1 sala de musculación.  Ayuda técnica para la accesibilidad: 1 ascensor.";"Metro: Pacífico.  Bus: 37 , 57.  Renfe: Méndez Álvaro.  Bicicleta:   Servicio Bicimad, para consultar la estación más cercana, acceda al mapa de geolocalización de las estaciones.";"";"1";"http://www.madrid.es/sites/v/index.jsp?vgnextchannel=bfa48ab43d6bb410VgnVCM100000171f5a0aRCRD&vgnextoid=c737b0c40971c010VgnVCM1000000b205a0aRCRD";"ALBERCHE";"CALLE";"V";"21";"";"";"";"";"MADRID";"MADRID";"28007";"1";"PACIFICO";"3";"RETIRO";"442475";"4472465";"40.400799189712316";"-3.6778902970366896";"91 433 27 58";"91 552 28 78";"secretaria@fmkarate.com";"/contenido/entidadesYorganismos/CentrosEspaciosDeporte/Gimnasios"
140197;"Centro Deportivo Municipal El Espinillo";"";"Horario de uso de las instalaciones deportivas  Para saber el horario de apertura de las distintas instalaciones del centro deportivo, les rogamos lo consulten con el propio centro. Horario de taquilla:  Lunes a Viernes de 8,45 a 20,30 horas. Sábados y domingos de 8,45 a 14 horas. Festivos cerrado.  Cierre completo del centro:  Mes de agosto y los días 24, 25 y 31 de diciembre, 1 de enero y 1 de mayo.";"Clases y escuelas deportivas    Pre-infantiles (de 2 a 3 años): matronatación y natación.  Infantiles (edad, según modalidades): natación y salvamentoacuático.  Jóvenes y personas adultas: aeróbic, carrera acuática (acuarunning), aeróbic, combinada (fitness y natación), fitness, gimnasia acuática  (acuagim), gimnasia de compensación, natación, pilates y salvamento acuático.  Mayores 65 años: gimnasia acuática (acuagim) y natación.  Personas con discapacidad: natación (infantil y adulta).  Programa deportivo en la calle:  caminar por Madrid.    Equipamientos    Superficie total de las instalaciones: 11.350 metros cuadrados.  Unidades deportivas cubiertas: piscina (vaso de 25 metros y vaso de enseñanza) y 2 salas multiusos.  Oficina de promoción deportiva: responsable de la coordinación de Juegos Deportivos Municipales, Torneos y Circuitos Municipales, Copas de Primavera. Además, ofrece información sobre las escuelas de promoción deportiva.    Servicio deportivo sanitario: enfermería deportiva.  Ayudas técnicas para la accesibilidad: 1 ascensor y 1 grúa de piscina.  Columna de rescate cardíaco.";"Bus: 23, 123, 130  Metro: Villaverde Bajo Cruce  Renfe: Villaverde Bajo  Bicicleta: el centro dispone de aparca bicicletas interior con capacidad para 4 bicicletas.";"";"1";"http://www.madrid.es/sites/v/index.jsp?vgnextchannel=bfa48ab43d6bb410VgnVCM100000171f5a0aRCRD&vgnextoid=9cdc79262ef5d010VgnVCM1000000b205a0aRCRD";"VILLAVERDE A VALLECAS";"CARRETERA";"V";"19";"";"";"";"";"MADRID";"MADRID";"28041";"4";"LOS ROSALES";"17";"VILLAVERDE";"441698";"4467536";"40.35634193991933";"-3.686595141820635";"913 603 265";"";"idmespinillo@madrid.es";"/contenido/entidadesYorganismos/CentrosEspaciosDeporte/Piscinas"
84661;"Centro Deportivo Municipal El Olivillo";"";"Horario de uso de las instalaciones deportivas   Para saber el horario de apertura de las distintas instalaciones del centro deportivo, les rogamos lo consulten con el propio centro.  Cierre completo del centro   Los días 24, 25 y 31 de diciembre, 1 de enero y 1 de mayo.";"Clases y escuelas deportivas    Infantiles (6 a 14 años): tenis de mesa.   Equipamientos.    Superficie total de las instalaciones: 2.660 metros cuadrados.  Unidades deportivas cubiertas:  pabellón polideportivo.   Deportes practicables:  baloncesto y fútbol sala.";"Metro: Lucero.  Bus: 31, 33, 36, 39, 65.";"";"0";"http://www.madrid.es/sites/v/index.jsp?vgnextchannel=bfa48ab43d6bb410VgnVCM100000171f5a0aRCRD&vgnextoid=61ff5c2cdc41c010VgnVCM2000000c205a0aRCRD";"OLIVILLO";"CALLE";"V";"4";"";"";"";"";"MADRID";"MADRID";"28011";"3";"LUCERO";"10";"LATINA";"436711";"4473147";"40.40652470221465";"-3.745889233801086";"914 790 212";"";"idmolivillo@madrid.es";"/contenido/entidadesYorganismos/CentrosEspaciosDeporte/Gimnasios"
4685;"Centro Deportivo Municipal El Quijote";"";"Horario de uso de las instalaciones deportivas:   Para saber el horario de apertura de las distintas instalaciones del centro deportivo, les rogamos lo consulten con el propio centro.  Horario del centro:     De lunes a viernes no festivos:  de 8,30 a 21,30 horas. Sábados, domingos y festivos: de 9 a 14,30 horas.  Horario de taquilla:   De lunes a viernes: de 8,30 a 20,30 horas Sábados y domingos: de 8,30 a 14,30 horas (solo el primer y último fin de semana de cada mes). Festivos: cerrada.   Cierre completo del centro: 24, 25 y 31 de diciembre, 1 de enero y 1 de mayo.";"Clases y escuelas deportivas    Pre-Infantiles (4 y 5 años): Actividad física y juegos.  Infantiles (6 a 14 años, según modalidades): Baile y Pádel  Jóvenes y adultos (15 a 64 años, según modalidades): Cross training (cubo gym), Cuerpo y mente, Entrenam. funcional, Entrenam. por intervalos (HIT), Entrenam. Propioceptivo, Estiramientos-relajación, Fitness, Core, GAP, Hipopresivos, Pádel, Pilates, Taichí, Yoga y combinadas.  Mayores de 65 años: Acondicionamiento físico.  Programa deportivo en la calle: Ejercicio físico por Madrid.   Equipamientos    Superficie total de las instalaciones: 11.500 metros cuadrados.  Unidades deportivas cubiertas: 2 salas multiusos, 1 sala de musculación.  Unidades deportivas al aire libre: 4 pistas de pádel (paredes de cristal), piscina de verano (vaso de recreo 36 x 20,50 metros, y vaso de chapoteo 12 x 12 metros; con sistema de depuración salina).  Ayudas técnicas a la accesibilidad: instalación practicable.  Columna de rescate cardíaco.";"Metro:  Francos Rodríguez.  Bus:  44, 64, 126, 127, 128, 132.  Bicicleta:    Servicio Bicimad, para consultar la estación más cercana, acceda al mapa de geolocalización de las estaciones";"";"1";"http://www.madrid.es/sites/v/index.jsp?vgnextchannel=bfa48ab43d6bb410VgnVCM100000171f5a0aRCRD&vgnextoid=01d7b0c40971c010VgnVCM1000000b205a0aRCRD";"NUMANCIA";"CALLE";"V";"11";"";"";"";"";"MADRID";"MADRID";"28039";"3";"CIUDAD UNIVERSITARIA";"9";"MONCLOA-ARAVACA";"439538";"4478346";"40.45357807068047";"-3.7130529027048587";"914599871";"";"idmelquijote@madrid.es";"/contenido/entidadesYorganismos/CentrosEspaciosDeporte/Piscinas"
4676;"Centro Deportivo Municipal Entrevías";"";"Horario de uso de las instalaciones deportivas   Para saber el horario de apertura de las distintas instalaciones del centro deportivo, les rogamos lo consulten con el propio centro.  Horario de taquilla    De lunes a viernes: de 8:30 a 14,30 y de 14:45 a 20:30 horas.  Sabádos, domingos y festivos: de 8:30 a 14,30 horas.     Cierre completo del centro      Los días 24, 25 y 31 de diciembre, 1 de enero y 1 de mayo.";"Clases y escuelas deportivas    Pre infantiles  actividad física y juegos, matrogimnasia, matronatación y natación peques.  Infantiles (edad, según modalidades): natación, fútbol, hábitos saludables,  polideportiva, pretenis, tenis y voleibol.  Jóvenes y personas adultas: acondicionamiento de nadadores, combinada (acuagim-fitness, natación-pilates), fitness, fútbol, hábitos saludables, natación, natación embarazadas, pilates y tenis.  Mayores 65 años: acondicionamiento físico, hábitos saludables, natación y pilates.  Personas con discapacidad: natación.  Programa deportivo en la calle:  caminar por Madrid.    Equipamientos     Superficie total de las instalaciones:  41.800 metros cuadrados.  Unidades deportivas al aire libre: 1 campo de fútbol (de césped artificial), piscina (vaso de 50 metros y vaso infantil), 2 pistas de tenis, rocódromo y tenis de mesa.  Unidades deportivas cubiertas: pabellón polideportivo, piscina (vaso de 25 metros y vaso de enseñanza), 1 pista polideportiva, 2 salas multiusos y sala de musculación.  Oficina de promoción deportiva:  responsable de la coordinación de Juegos Deportivos Municipales, Torneos y Circuitos Municipales, Copas de Primavera. Además, ofrece información sobre las escuelas de promoción deportiva.  Ayuda técnica para la accesibilidad:  1 ascensor y 1 grúa de piscina.  Columna de rescate cardíaco.";"Bus: 24, 102, 103, 111.  Renfe: Asamblea de Madrid - Entrevías.  Bicicleta:  El centro dispone de aparca bicicletas exterior con capacidad para 5 bicicletas.  Servicio Bicimad, para consultar la estación más cercana, acceda al mapa de geolocalización de las estaciones.";"";"1";"http://www.madrid.es/sites/v/index.jsp?vgnextchannel=bfa48ab43d6bb410VgnVCM100000171f5a0aRCRD&vgnextoid=1e57b0c40971c010VgnVCM1000000b205a0aRCRD";"SUR";"RONDA";"V";"4";"";"";"";"";"MADRID";"MADRID";"28053";"1";"ENTREVIAS";"13";"PUENTE DE VALLECAS";"442741";"4469977";"40.378413212706285";"-3.674532317137481";"917 854 214";"";"idmentrevias@madrid.es";"/contenido/entidadesYorganismos/CentrosEspaciosDeporte/CamposEstadiosFutbol"
6486044;"Centro Deportivo Municipal Escuelas de San Antón";"";"Horario de uso de las instalaciones deportivas:   Para saber el horario de apertura de las distintas instalaciones del centro deportivo, les rogamos lo consulten con el propio centro.  Horario de taquilla   De lunes a viernes, de 7 a 22,30 horas. Sábados, de 8 a 20,30 horas. Domingos y festivos, de 9 a 18,30 horas.   Cierre completo del centro   Los días 24, 25 y 31 de diciembre, 1 de enero y 1 de mayo.";"Clases y escuelas deportivas    Pre infantiles: (0 a 3 años) natación.  Infantiles (edad, según modalidades): natación.  Personas jóvenes y adultas: gimnasia acuática (acuagim), natación, natación de compensación y natación embarazadas.  Mayores 65 años: gimnasia acuática (acuagim) y natación.  Actividades para personas con discapacidad física: natación.  Actividades para personas con discapacidad Intelectual:   natación.     Equipamientos    Superficie total de las instalaciones:   Planta tercera: 971,29 metros cuadrados. Planta cuarta: 976,21 metros cuadrados. Entreplanta cuarta: 291,28 metros cuadrados.     Unidades deportivas cubiertas:  piscina (vaso de 25 metros y vaso de enseñanza), sala musculación y  zona spa.  Solárium.   Ayudas técnicas para la accesibilidad:  1 ascensor y 1 grúa de piscina.    Columna de rescate cardíaco.";"Bus: 3.  Metro: Chueca y Tribunal.  Bicicleta:   Servicio Bicimad, para consultar la estación más cercana, acceda al mapa de geolocalización de las estaciones.";"";"1";"http://www.madrid.es/sites/v/index.jsp?vgnextchannel=bfa48ab43d6bb410VgnVCM100000171f5a0aRCRD&vgnextoid=4f9aad5078828310VgnVCM1000000b205a0aRCRD";"FARMACIA";"CALLE";"V";"13";"";"";"";"";"MADRID";"MADRID";"28004";"4";"JUSTICIA";"1";"CENTRO";"440704";"4475035";"40.42382670120857";"-3.699010103263697";"918 289 006";"";"info@cdmescuelassananton.com";"/contenido/entidadesYorganismos/CentrosEspaciosDeporte/Gimnasios"
10663007;"Centro Deportivo Municipal Estadio de Atletismo Vallehermoso";"El estadio dispone de una pista con 8 calles y 400 metros de cuerda, con curvas  de  un  solo  radio  de  36,5 metros  y pavimentación  con  material  sintético; graderío, parcialmente cubierto, para 10.000 espectadores, todos sentados; y una recta cubierta de entrenamiento de 75 x 12 metros, que es una de las principales señas de identidad características de este nuevo equipamiento, por su ubicación sobre las gradas y su peculiar arquitectura. El nuevo &amp;ldquo;templo&amp;rdquo; del atletismo al aire libre albergará grandes competiciones nacionales e internacionales, así como todas las pruebas federadas y municipales de carácter local, además de disponer de escuelas de promoción de este deporte.";"Horario de uso de las instalaciones deportivas: De lunes a domingo de 8:30 a 21:30 horas.";"También cuenta con 9 calles en la recta de tribuna, una recta de 110 metros y 2 colas sobresaliendo del anillo; &amp;ldquo;calle 10&amp;rdquo; de césped artificial, exterior al anillo de la pista, para rodadores de fondo; dotación de pasillos dobles para concurso de saltos, pasillos y círculos de lanzamientos sobre un campo interior de césped natural y, como es lógico, control de accesos, oficinas, vestuarios, almacenes, salas técnicas y aseos y demás equipamientos para la práctica de la competición de atletismo al aire libre.";"Metro: Canal (L2, L7), Guzmán el Bueno (L6, L7), Islas Filipinas (L7), Ríos Rosas (L1)  Bus: 2, 12, 44, N21  Bicicleta:  Servicio Bicimad, para consultar la estación más cercana, acceda al mapa de geolocalización de las estaciones";"";"0,5,6";"http://www.madrid.es/sites/v/index.jsp?vgnextchannel=bfa48ab43d6bb410VgnVCM100000171f5a0aRCRD&vgnextoid=10c0f41a5b442610VgnVCM2000001f4a900aRCRD";"MELQUIADES ALVAREZ";"CALLE";"V";"19";"";"";"";"esquina con calle Jesús Maestro";"Madrid";"";"28003";"6";"VALLEHERMOSO";"7";"CHAMBERI";"439737";"4477081";"40.44220302362995";"-3.7105841985334544";"914 804 751 - 915 132 774";"";"estadiovallehermoso@madrid.es";"/contenido/entidadesYorganismos/CentrosEspaciosDeporte"
4728;"Centro Deportivo Municipal Estanque del Retiro";"";"Horario: de lunes a domingo de 10 a 14 horas y de 15:15 horas hasta la puesta de sol.  Cierres: entre las 17:15 y las 20:30 horas, en función de la época del año (ver fechas y horarios detallados en más información).  Cierre completo del centro: días 24, 25 y 31 de diciembre y 1 de enero.";"Deportes practicables: pirag&amp;uuml;ismo y remo (recreativo y deportivo).  Uso de espacios deportivos: barcas de recreo.   Equipamientos     Superficie total de las instalaciones:  37.000 metros cuadrados.   Unidades deportivas al aire libre:  estanque, barcas de paseo y remo.  Ayudas técnicas para la accesibilidad:   instalación adaptada.    Columna de rescate cardíaco.";"Metro: Retiro e Ibiza.  Bus: 1, 2, 9, 15, 19, 20, 28, 51, 52, 74, 146, 152 y 202.  Renfe: Recoletos.   Bicicleta:   servicio Bicimad , para consultar la estación más cercana, acceda al  mapa de geolocalización de las estaciones .";"Información y reservas:   Las barcas del estanque del Retiro se pueden reservar a través de la taquilla del propio centro deportivo municipal.  Fechas y horarios de cierre de taquilla:   Desde el 4 de enero hasta el 24 de enero el horario de cierre de taquilla es a las 17,30 horas.   Desde el 25 de enero hasta el 7 de febrero el horario de cierre de taquilla es a las 17,45 horas.   Desde el 8 de febrero hasta el 21 de febrero el horario de cierre de taquilla es a las 18,00 horas.   Desde el 22 de febrero hasta el 7 de marzo el horario de cierre de taquilla es a las 18,15 horas.   Desde 8 de marzo hasta el 21 de marzo el horario de cierre de taquilla es a las 18,30 horas.   Desde el 22 de marzo hasta el 29 de marzo el horario de cierre de taquilla es a las 18,45 horas.   Desde el 30 de marzo hasta el 11 de abril el horario de cierre de taquilla es a las 19,45 horas.   Desde el 12 de abril hasta el 25 de abril el horario de cierre de taquilla es a las 20,00 horas.   Desde el 26 de abril hasta el 9 de mayo el horario de cierre de taquilla es a las 20,15 horas.   Desde el 10 de mayo hasta el 22 de agosto el horario de cierre de taquilla es a las 20,30 horas.   Desde el 23 de agosto hasta el 5 de septiembre el horario de cierre de taquilla es a las 20,15 horas.   Desde el 06 de septiembre hasta el 12 de septiembre el horario de cierre de taquilla es a las 20,00 horas.   Desde el 13 de septiembre hasta el 19 de septiembre el horario de cierre de taquilla es a las 19,45 horas.   Desde el 20 de septiembre hasta el 26 de septiembre el horario de cierre de taquilla es a las 19,30 horas.   Desde el 27 de septiembre hasta el 10 de octubre el horario de cierre de taquilla es a las 19,15 horas.   Desde el 11 de octubre hasta el 17 de octubre el horario de cierre de taquilla es a las 19,00 horas.   Desde el 18 de octubre hasta el 25 de octubre el horario de cierre de taquilla es a las 18,45 horas.   Desde el 26 de octubre hasta el 7 de noviembre el horario de cierre de taquilla es a las 17,45 horas.   Desde el 08 de noviembre hasta el 21 de noviembre el horario de cierre de taquilla es a las 17,30 horas.   Desde el 21 de noviembre hasta el 03 de enero el horario de cierre de taquilla es a las 17,15horas.";"2";"http://www.madrid.es/sites/v/index.jsp?vgnextchannel=bfa48ab43d6bb410VgnVCM100000171f5a0aRCRD&vgnextoid=6487b0c40971c010VgnVCM1000000b205a0aRCRD";"COLOMBIA";"PASEO";"V";"2";"";"";"";"";"MADRID";"MADRID";"28009";"5";"LOS JERONIMOS";"3";"RETIRO";"441930";"4474426";"40.418436005960814";"-3.6845031319515718";"915 744 024                      
915 571 994";"";"idmretiro@madrid.es";"/contenido/entidadesYorganismos/CentrosEspaciosDeporte/Embarcaderos"
4622862;"Centro Deportivo Municipal Fabián Roncero";"";"Horario de uso de las instalaciones deportivas  Para saber el horario de apertura de las distintas instalaciones del centro deportivo, le rogamos lo consulten con el propio centro.    Horario de taquilla   De lunes a viernes: de 7 a 23 horas. Sábados: de 9 a 20 horas. Domingos y festivos: de 9 a 15 horas.   Cierre completo del centro    Días 25 de diciembre, 1 de enero y 1 de mayo.";"Clases y escuelas deportivas    Pre infantiles (0 a 3 años):  matronatación y natación. Infantiles (edad, según modalidades): actividad física y juegos, aeróbic, natación, natación sincronizada, salvamento acuático y waterpolo.  Personas jóvenes y adultas:  acondicionamiento nadadores, aeróbic, carrera acuática (acuarunning), ciclo sala, combinada/compensación, gimnasia acuática (acuagim), gimnasia suave, gap (glúteos, abdomen, piernas), entrenamiento funcional (suspensión, hit, trx), estiramientos/relax, fitness, fitness acuático, natación, natación embarazadas y  pilates.    Mayores 65 años: actividad física, gimnasia acuática (acuagim), gimnasia suave y natación.    Actividades para personas con discapacidad física: natación.     Actividades para personas con discapacidad intelectual: natación.    Solárium.      Equipamientos          Superficie  total de las instalaciones  4.400 metros cuadrados.     Unidades deportivas cubiertas:piscina (vaso de 25 metros y vaso de enseñanza), sala multiusos, sala multiusos (cardio), sala multiusos (ciclo sala) y sala de musculación.  Columna de rescate cardíaco.";"Bus: 77.  Metro: Canillejas.  Bicicleta:   El centro dispone de aparcabicicletas exterior con capacidad para 25 bicicletas. Servicio Bicimad, para consultar la estación más cercana, acceda al mapa de geolocalización de las estaciones.";"";"1";"http://www.madrid.es/sites/v/index.jsp?vgnextchannel=bfa48ab43d6bb410VgnVCM100000171f5a0aRCRD&vgnextoid=887e306502624110VgnVCM1000000b205a0aRCRD";"SEPTIMA";"AVENIDA";"V";"68";"";"";"";"";"MADRID";"MADRID";"28022";"6";"REJAS";"20";"SAN BLAS-CANILLEJAS";"449327";"4477838";"40.44965684114441";"-3.597577201182505";"917 462 995";"";"recepcionfr@thinkingup.fitness";"/contenido/entidadesYorganismos/CentrosEspaciosDeporte/Gimnasios"
