PK;NOMBRE;DESCRIPCION-ENTIDAD;HORARIO;EQUIPAMIENTO;TRANSPORTE;DESCRIPCION;ACCESIBILIDAD;CONTENT-URL;NOMBRE-VIA;CLASE-VIAL;TIPO-NUM;NUM;PLANTA;PUERTA;ESCALERAS;ORIENTACION;LOCALIDAD;PROVINCIA;CODIGO-POSTAL;COD-BARRIO;BARRIO;COD-DISTRITO;DISTRITO;COORDENADA-X;COORDENADA-Y;LATITUD;LONGITUD;TELEFONO;FAX;EMAIL;TIPO
5984172;"Parque Aluche";"El Parque de Aluche, ubicado en el centro del barrio, se extiende de norte a sur, en dos zonas alargadas divididas por la calle Illescas. En el área sur, se encuentra una ría que sigue el curso del antiguo arroyo de Luche, rodeada de bloques de granito provenientes de la sierra de Guadarrama y cruzado por varias pasarelas . Este parque ofrece amplias áreas de césped, senderos para paseos y zonas sombreadas ideales para hacer un picnic o relajarse. Las instalaciones deportivas son variadas e incluyen campos de fútbol, baloncesto, pistas de patinaje y de petanca, además de espacios para juegos infantiles y un área canina en la zona norte. También cuenta con un auditorio para eventos al aire libre.  La vegetación es diversa, con rodales de pinos y franjas de chopos, liquidámbares y carpes, formando barreras naturales en los límites del parque. Junto a la ría y en las zonas de descanso, se pueden apreciar otras especies como cedros, cipreses, ginkgos, álamos, acacias y tilos. Asimismo, un tramo de carril bici bordea el parque en el lateral que da a la calle Valmojado. Fue inaugurado el 25 de julio de 1973. Anteriormente a su nombre actual, fue denominado oficialmente como Parque Alcalde Carlos Arias, si bien el nombre popular siempre ha sido el actual de Parque Aluche, reconocido en 2016. En 2010 se hizo una importante rehabilitaciñon, y nuevas mejoras en 2022.";"";"Zonas infantiles Zonas de mayores Instalaciones deportivas Auditorios Carril bici Carrusel Kiosco";"Metro: Aluche (linea 5) Bus: 25, 121, 131 y 138 RENFE: Aluche";"Conservación: Dirección General de Gestión del Agua y Zonas Verdes, Área de Gobierno de Medio Ambiente y Movilidad.  Superficie: Área de 143.788 m&amp;sup2;.  Vegetación predominante:    Ejemplares arbóreos: Álamo plateado (Populus alba), pino piñonero (Pinus pinea), mimosa plateada (Mimosa pudica) y olmo de Siberia (Ulmus pumila).  Arbustos: Bambú (Bambusoideae), junípero horizontal (Juniperus horizontalis) y laurel cerezo (Prunus laurocerasus).  Macizos arbustivos: Pitosporo (Pittosporum spp.), espino de fuego (Pyracantha coccinea) y espirea (Spiraea spp.).";"2";"http://www.madrid.es/sites/v/index.jsp?vgnextchannel=bfa48ab43d6bb410VgnVCM100000171f5a0aRCRD&vgnextoid=c5b4abb9e009e210VgnVCM1000000b205a0aRCRD";"TEMBLEQUE";"CALLE";"V";"45";"";"";"";"";"MADRID";"MADRID";"28024";"4";"ALUCHE";"10";"LATINA";"435562";"4471802";"40.394320359418835";"-3.7592814565910553";"";"";"";"/contenido/entidadesYorganismos/ParquesJardines"
5986186;"Parque Aluche - Poblados";"Este parque ofrece amplias zonas de césped y áreas arboladas ideales para el descanso y el esparcimiento, complementadas con bancos, senderos para pasear y áreas sombreadas que lo convierten en un lugar idóneo para relajarse. Dispone de dos acogedoras áreas de juegos infantiles debidamente delimitadas, tres pistas de petanca y una pista de fútbol sala. A la entrada, destacan dos grandes jardineras que albergan un olivo cada una, aportando un toque natural y distintivo al acceso del parque.";"";"Zonas infantiles Instalaciones deportivas Pistas de petanca";"Metro: Aluche (linea 5) Bus: 17, 117, 139 Renfe: Aluche  Servicio Bicimad, para consultar la estación más cercana, acceda al mapa de geolocalización de las estaciones.";"Conservación: Dirección General de Gestión del Agua y Zonas Verdes, Área de Gobierno de Medio Ambiente y Movilidad.  Superficie: Área de 24.003 m&amp;sup2;.  Vegetación predominante:    Ejemplares arbóreos: Arce (Acer spp.), pino piñonero (Pinus pinea), tilo de hojas grandes (Tilia platyphyllos) y álamo blanco (Populus alba).  Macizos arbustivos: Evónimo (Euonymus spp.), espirea (Spiraea spp.) y fotinia (Photinia x fraseri).";"2";"http://www.madrid.es/sites/v/index.jsp?vgnextchannel=bfa48ab43d6bb410VgnVCM100000171f5a0aRCRD&vgnextoid=f96136c32a59e210VgnVCM2000000c205a0aRCRD";"GUAREÑA";"CALLE";"V";"22";"";"";"";"";"MADRID";"MADRID";"28044";"7";"LAS AGUILAS";"10";"LATINA";"435053";"4470820";"40.38543450752234";"-3.765190215590101";"";"";"";"/contenido/entidadesYorganismos/ParquesJardines"
5981072;"Parque Alzola";"El Parque Alzola se encuentra entre la Avenida Rafaela Ybarra y la calle Guetaria. Este espacio verde se caracteriza por sus amplias praderas de césped y abundantes macizos arbustivos, además de contar con una extensa zona terriza lateral adornada con arbolado. Es un lugar agradable tanto para pasear como para disfrutar del ocio al aire libre. Las diferentes áreas del parque están conectadas por un camino principal adoquinado que lo atraviesa de extremo a extremo. En su parte central, destaca una zona infantil ubicada cerca de una plaza de descanso, rodeada de rosales, ofreciendo un ambiente tranquilo y acogedor para los visitantes.";"";"Zonas infantiles Parking";"Bus: 60 , 131  Servicio Bicimad, para consultar la estación más cercana, acceda al mapa de geolocalización de las estaciones.";"Conservación: Dirección General de Gestión del Agua y Zonas Verdes, Área de Gobierno de Medio Ambiente y Movilidad.  Superficie: Área de 10.495 m&amp;sup2;.  Vegetación predominante:    Ejemplares arbóreos: Árbol del amor (Cercis siliquastrum), acacia del Japón (Robinia pseudoacacia), ciprés común (Cupressus sempervirens) y falsa acacia (Gleditsia triacanthos).  Arbustos: Yuka (Yucca spp.), aligustre (Ligustrum spp.) y palmera canaria (Phoenix canariensis).  Macizos arbustivos: Lilo (Syringa spp.), espirea (Spiraea spp.) y adelfa (Nerium oleander).";"2";"http://www.madrid.es/sites/v/index.jsp?vgnextchannel=bfa48ab43d6bb410VgnVCM100000171f5a0aRCRD&vgnextoid=82a58b930b67e210VgnVCM2000000c205a0aRCRD";"BEASAIN";"CALLE";"V";"2";"";"";"";"";"MADRID";"MADRID";"28041";"1";"ORCASITAS";"12";"USERA";"439410";"4468756";"40.36716919688689";"-3.7136655626692887";"";"";"";"/contenido/entidadesYorganismos/ParquesJardines"
5994520;"Parque Antonio Pirala";"El Parque Antonio Pirala, diseñado por la arquitecta Myriam Silber Brodsky, es un espacio verde que recibió en 1995 el Premio Alhambra otorgado por la Asociación Española de Parques y Jardines Públicos. Este parque se sitúa estratégicamente en la confluencia de la calle Alcalá con el Puente de Ventas y la M-30, extendiéndose hasta una plaza aledaña en la calle Santiago Massarnaú. El parque se estructura en diversas áreas bien definidas. Una escalinata, que consta de varios tramos, destaca por una fuente ornamental en uno de sus lados y jardineras de ladrillo adornadas con plantaciones. Una cuadrícula de árboles, intercalada con acequias, conduce hacia un espacio con juegos infantiles y mesas de ajedrez, rematado por una segunda fuente ornamental en forma de pirámide truncada escalonada, rodeada de parterres y numerosos bancos.  También incluye un área canina y varias pistas deportivas para fútbol y baloncesto, flanqueadas por plantaciones de diversas especies vegetales. La composición del parque culmina con una pequeña zona forestal que se extiende hasta una pasarela.";"";"Zonas infantiles Zonas caninas Instalaciones deportivas";"Metro: Carmen, Ventas (linea 5 y linea 2) Bus: 38, 106, 110, 146, 210  Servicio Bicimad, para consultar la estación más cercana, acceda al mapa de geolocalización de las estaciones.";"Conservación: Dirección General de Gestión del Agua y Zonas Verdes, Área de Gobierno de Medio Ambiente y Movilidad.  Superficie: Área de 21.675 m&amp;sup2;.  Vegetación predominante:    Ejemplares arbóreos: Álamo blanco (Populus alba), olmo de Siberia (Ulmus pumila), pino piñonero (Pinus pinea) y paulonia (Paulownia spp.).  Arbustos: Boj (Buxus sempervirens), fotinia (Photinia x fraseri) y durillo (Viburnum tinus).  Macizos arbustivos: Hiedra (Hedera helix), espino de fuego (Pyracantha coccinea) y griñolera (Lycium barbarum).";"2";"http://www.madrid.es/sites/v/index.jsp?vgnextchannel=bfa48ab43d6bb410VgnVCM100000171f5a0aRCRD&vgnextoid=d77f1a2a419be210VgnVCM1000000b205a0aRCRD";"ANTONIO PIRALA";"CALLE";"V";"8";"";"";"";"";"MADRID";"MADRID";"28017";"1";"VENTAS";"15";"CIUDAD LINEAL";"444047";"4475544";"40.428652595625735";"-3.659649292346212";"";"";"";"/contenido/entidadesYorganismos/ParquesJardines"
5962985;"Parque Anunciación";"El Parque Anunciación es un espacio modesto, pero ideal para que los niños jueguen y se diviertan en un entorno seguro y acogedor. El parque cuenta con diversas instalaciones de juego, como toboganes, columpios y estructuras para escalar, todas diseñadas para fomentar la creatividad y la actividad física de los más pequeños. Además, está rodeado de zonas verdes y árboles, lo que contribuye a crear un ambiente fresco y agradable. Entre su arbolado, destacan los majestuosos cedros de gran porte que embellecen el entorno.";"";"";"Bus: 20, 26, 63.  Servicio Bicimad, para consultar la estación más cercana, acceda al mapa de geolocalización de las estaciones.";"Conservación:  Dirección General de Gestión del Agua y Zonas Verdes, Área de Gobierno de Medio Ambiente y Movilidad.   Superficie: 4.088 m&amp;sup2;.  Vegetación predominante:    Ejemplares arbóreos: ciprés de Arizona (Cupressus arizonica), tilo de hojas grandes (Tilia platyphyllos), tuya occidental (Thuja occidentalis) y cedro del Atlas (Cedrus atlantica).  Arbustos: tuya oriental (Platycladus orientalis), evónimo (Euonymus spp.) y laurel cerezo (Prunus laurocerasus).  Macizos arbustivos: griñolera (Cotoneaster spp.), pitosporo (Pittosporum tobira) y adelfa (Nerium oleander).";"2";"http://www.madrid.es/sites/v/index.jsp?vgnextchannel=bfa48ab43d6bb410VgnVCM100000171f5a0aRCRD&vgnextoid=18f52d0109d2e210VgnVCM2000000c205a0aRCRD";"ANUNCIACION";"CALLE";"V";"1";"";"";"";"";"MADRID";"MADRID";"28009";"6";"NIÑO JESUS";"3";"RETIRO";"442659";"4473699";"40.41192841997151";"-3.67583331713166";"";"";"";"/contenido/entidadesYorganismos/ParquesJardines"
5985636;"Parque Arquitecto Antonio Palacios";"El Parque Arquitecto Antonio Palacios presenta un diseño basado en círculos concéntricos, cada uno de los cuales tiene una configuración particular. Algunos están pavimentados con terrizo, otros albergan árboles, otros están compuestos por árboles acompañados de arbustos. En uno de los círculos se encuentran diversas especies de Juniperus, otro está cubierto por pradera. Los árboles que predominan son; morera, pino piñonero, fresno y castaño de Indias. Los arbustos y macizos arbustivos, espino de fuego, pitosporo, adelfa y berberis. El parque incluye una zona infantil rodeada de pinos de gran porte, destacando un ejemplar al que se le ha diseñado una jardinería especial para resaltar su valor ornamental. Además, uno de los elementos más llamativos del parque es un conjunto escultural en el centro de una glorieta circular, formada por tres piezas verticales de acero corten, levantadas como  totems o estelas. El conjunto escultórico está dedicado al arquitecto gallego Antonio Palacios, que modernizó la ciudad de Madrid a principios del siglo XX, dándole un carácter más cosmopolita y monumental. En 1963 se construyó la Unidad Vecinal de Absorción (UVA) de Canillejas, conjunto de viviendas provisionales realizado dentro de un plan para atajar la proliferación de infraviviendas. Tras veinte años se derribó y convirtió en una zona ajardinada, a un extremo de la cual se realojó a la población, en tres edificios de altura diseñados en 1986. La plaza conservó parte del arbolado que tenía la U.V.A y en uno de esos grupos de pinos, que se rodearon por una glorieta circular con bancos, es donde se instaló la escultura.";"";"Zonas infantiles Esculturas";"Metro: Torre Arias (línea 5) Bus: 28, 48  Servicio Bicimad, para consultar la estación más cercana, acceda al mapa de geolocalización de las estaciones.";"Conservación: Dirección General de Gestión del Agua y Zonas Verdes, Área de Gobierno de Medio Ambiente y Movilidad.  Superficie: Área de 13.850 m&amp;sup2;.  Vegetación predominante:    Ejemplares arbóreos: Morera (Morus spp.), pino piñonero (Pinus pinea), fresno (Fraxinus spp.) y castaño de Indias (Aesculus hippocastanum).  Arbustos: Espino de fuego (Pyracantha coccinea).  Macizos arbustivos: Pitosporo (Pittosporum spp.), adelfa (Nerium oleander) y berberis (Berberis spp.).";"2";"http://www.madrid.es/sites/v/index.jsp?vgnextchannel=bfa48ab43d6bb410VgnVCM100000171f5a0aRCRD&vgnextoid=a4e39f4e0f49e210VgnVCM2000000c205a0aRCRD";"FENELON";"CALLE";"V";"17";"";"";"";"";"MADRID";"MADRID";"28022";"7";"CANILLEJAS";"20";"SAN BLAS-CANILLEJAS";"448372";"4476604";"40.43847239256322";"-3.6087501533089923";"";"";"";"/contenido/entidadesYorganismos/ParquesJardines"
5979932;"Parque Arroyo Fontarrón";"El Parque Arroyo Fontarrón es un extenso espacio verde ubicado en el entorno de la autovía A3 en su cruce con la M40. Su nombre hace referencia a uno de los numerosos arroyos que atravesaban el hoy distrito de Moratalaz, y que eran tributarios del Abroñigal. Un puente peatonal y ciclista  sobrepasa la autovía y conecta los distritos de Moratalaz y Puente de Vallecas, dando acceso al Parque Lineal de Palomeras. Su paisaje combina taludes periféricos cubiertos de césped, senderos y áreas sombreadas para disfrutar de actividades al aire libre.  El parque se divide en dos zonas distintivas: una de carácter forestal, con vegetación más densa, atravesada por el Anillo Verde Ciclista, y otra con árboles y arbustos ornamentales, que añaden color y diversidad, atravesada por una senda en terrizo arbolada paralela a la avenida del Mediterráneo y la calle que da nombre al parque. Los árboles más abundante son pinos, olmos y almeces. Además, cuenta con instalaciones deportivas, como una cancha polivalente para baloncesto y fútbol, atrayendo a quienes desean realizar actividad física. También se encuentran dos áreas de juegos infantiles, diseñadas para el entretenimiento de la infancia.";"";"Zonas infantiles Zonas caninas";"Bus: 8, 20, 30, 100  Servicio Bicimad, para consultar la estación más cercana, acceda al mapa de geolocalización de las estaciones.";"Conservación: Dirección General de Gestión del Agua y Zonas Verdes, Área de Gobierno de Medio Ambiente y Movilidad.  Superficie: Área de 35.450 m&amp;sup2;.  Vegetación predominante:    Ejemplares arbóreos: Pino piñonero (Pinus pinea), olmo de Siberia (Ulmus pumila), álamo blanco (Populus alba) y olmo común (Ulmus minor).  Arbustos: Palo loro (Erythrina crista-galli).  Macizos arbustivos: Espino de fuego (Pyracantha coccinea), lavanda (Lavandula spp.) y enebro rastrero (Juniperus horizontalis).";"2";"http://www.madrid.es/sites/v/index.jsp?vgnextchannel=bfa48ab43d6bb410VgnVCM100000171f5a0aRCRD&vgnextoid=38c946a92b57e210VgnVCM1000000b205a0aRCRD";"ARROYO FONTARRON";"CALLE";"V";"22";"";"";"";"";"MADRID";"MADRID";"28030";"1";"PAVONES";"14";"MORATALAZ";"446012";"4471768";"40.39476596114844";"-3.6361646051817518";"";"";"";"/contenido/entidadesYorganismos/ParquesJardines"
5993155;"Parque Arroyo Fresno - Tomás y Valiente";"El Parque Arroyo Fresno es una extensa zona verde abierta que combina amplios espacios ajardinados con césped y arbolado joven, junto a una sección más forestal que incluye una gran lámina de agua. El parque cuenta con diversos paseos, dos pistas para la práctica de baloncesto y fútbol, y dos áreas de juegos infantiles delimitadas, una de ellas ubicada cerca de la estación de metro. Además, dispone de una fuente ornamental que añade atractivo al entorno. El parque también está bordeado por una franja del carril bici que circunda Madrid, muy utilizado por los vecinos. Este espacio es ideal para disfrutar de la naturaleza, ofreciendo un ambiente tranquilo y relajante, perfecto para desconectar del bullicio urbano. El parque fue inaugurado en el año 2000 siendo alcalde José María Álvarez del Manzano, tomando su nombre del Arroyo del Fresno, cercano al mismo. En 2019, por acuerdo de la Junta de Gobierno del Ayuntaiento, pasó a denominarse Parque Arroyo Fresno-Tomás y Valiente, en homenaje al jurista, escritor y presidente del Tribunal Constitucional asesinado en 1996 por la banda terrorista ETA.";"";"Zonas infantiles Instalaciones deportivas Zona de petancas";"Bus: 49  Servicio Bicimad, para consultar la estación más cercana, acceda al mapa de geolocalización de las estaciones.";"Conservación: Dirección General de Gestión del Agua y Zonas Verdes, Área de Gobierno de Medio Ambiente y Movilidad.  Superficie: Área de 107.657 m&amp;sup2;.  Vegetación predominante:    Ejemplares arbóreos: Pino piñonero (Pinus pinea), almez (Celtis australis), olmo de Siberia (Ulmus pumila) y plátano de sombra (Platanus x hispanica).  Arbustos: Ciruelo rojo (Prunus cerasifera).  Macizos arbustivos: Espino de fuego (Pyracantha coccinea) y agracejo (Berberis spp.).";"1";"http://www.madrid.es/sites/v/index.jsp?vgnextchannel=bfa48ab43d6bb410VgnVCM100000171f5a0aRCRD&vgnextoid=915fc8c5494be210VgnVCM2000000c205a0aRCRD";"VENTISQUERO DE LA CONDESA";"AVENIDA";"V";"43";"";"";"";"";"MADRID";"MADRID";"28035";"7";"MIRASIERRA";"8";"FUENCARRAL-EL PARDO";"439248";"4482708";"40.49284296962057";"-3.7169069720385446";"";"";"";"/contenido/entidadesYorganismos/ParquesJardines"
10703881;"Parque Arroyo Pozuelo";"El proyecto de este parque se inició en el año 2001 su objeto fue recuperar y ajardinar estos terrenos de propiedad pública. Mediante ello se buscó conservar y  potenciar todos los elementos naturales existentes. Dentro de estos elementos cabe destacar el arroyo que divide longitudinalmente el parque y le da nombre. El proyecto se ha ejecutado en varías fases incluyendo todas ellas un carril bici que facilita la movilidad a lo largo de todo el parque:  FASE 1 _ PARQUE ARROYO POZUELO: esta fase se extiende desde la calle Cuesta de Galván que limita con la carretera de Castilla (M-500), hasta la Ctra. Húmera-Aravaca. Fue el inició de este proyecto en el año 2001. Es la zona más ajardinada con extensas praderas de césped y paseos acompañados de arbolado en su mayoría joven. Acoge varias zonas infantiles, pistas de petanca y pistas deportivas bajo una de las cuales existe un amplio estanque de tormentas para la recogida de aguas.  FASE 2_ AMPLIACIÓN PARQUE ARROYO POZUELO: segunda fase de ajardinamiento de la ribera del arroyo, que se empezó en los años 2007-2008, se divide en dos tramos principales:    TRAMO 1. Se sitúa entre la Ctra. Húmera-Aravaca y la calle Golondrina. En esta zona se encuentra el Campo de Fútbol Nuestra Señora del Buen Camino. El ajardinamiento se caracteriza por la presencia de masas de arbustos acompañados de árboles de gran porte, arbolado original de la zona verde y un entramado de caminos que conectan distintas zonas estanciales y áreas infantiles.     TRAMO 2. Entre la calle Golondrina y el límite con el pueblo de Pozuelo. Esta fase se desarrolló solo en la ribera norte del arroyo. En este caso, salvo una zona ajardinada alrededor de una fuente ornamental, el diseño es mucho más forestal con plantaciones de arbolado de diversas especies. También hay zonas infantiles y para mayores, zonas estanciales y pistas deportivas.   FASE 3_ PARQUE. ARROYO POZUELO (AMPLIACIÓN) 2: tercera fase actualmente en desarrollo (iniciada en 2015), entre la calle Golondrina y el límite con el pueblo de Pozuelo, en la ribera sur del arroyo. Diseño forestal con entramado de caminos y renovación del arbolado. En esta zona se encuentra la urbanización privada Colonia Santa Maria.";"";"Zonas infantiles: 5 áreas infantiles distribuidos por el parque Zonas de mayores: 2 áreas Área canina. Instalaciones deportivas:   - Instalación deportiva municipal (2 pistas de baloncesto, 3 pistas de futbol sala y 2 campos de fútbol 11de tierra).   -   Instalación Deportiva Municipal Básica C.F. Nuestra Señora del Buen Camino (Campo de futbol 11 de hierba).     Carril bici: 2,1 kilómetros";"Transporte más próximo:  Autobús: 160  Otros trasportes cercanos:  Autobús: 161 Autobús interurbano: 658 Tren: Estación de Aravaca (Líneas C-7 y C-10) Metro-ligero/Tranvía: Estación de Aravaca (Línea 2)  Servicio Bicimad, para consultar la estación más cercana, acceda al mapa de geolocalización de las estaciones.";"Conservación: Dirección General de Gestión del Agua y Zonas Verdes, Área de Gobierno de Medio Ambiente y Movilidad.  Superficie total: Área de 276.111 m&amp;sup2;, dividida en tres fases:  FASE 1:   Superficie: Área de 92.099 m&amp;sup2;.  Vegetación predominante:    Ejemplares arbóreos: Tilo de hoja pequeña (Tilia cordata), catalpa (Catalpa bignoniodes), pino piñonero (Pinus pinea), almez (Celtis australis) y tilo de hoja grande (Tilia platyphyllos).  Arbustos: Rosa de Siria (Hibiscus syriacus), taray (Tamarix sp.), lilo (Syringa vulgaris), laurel cerezo (Prunus laurocerasus).  Macizos arbustivos: Abelia (Abelia floribunda), pitosporo (Pittosporum tobira), laurel cerezo (Prunus laurocerasus), taray (Tamarix sp.).   FASE 2:   Superficie: Área de 105.210 m&amp;sup2;.  Vegetación predominante:    Ejemplares arbóreos: Olmo de Siberia (Ulmus pumila), pino piñonero (Pinus pinea), castaño de Indias rojo (Aesculus carnea), almez (Celtis australis).  Arbustos: Tejo (Taxus baccata), taray (Tamarix sp.), madroño (Arbutus unedo), retama amarilla (Retama sphaerocarpa).  Macizos arbustivos: Olivilla (Teucrium fruticans), cotoneaster (Cotoneaster sp.), junípero horizontal (Juniperus horizontalis), adelfa (Nerium oleander).   FASE 3:   Superficie: Área de 78.802 m&amp;sup2; (de los cuales 73.760 m&amp;sup2; son superficie forestal).  Vegetación predominante:    Ejemplares arbóreos: Pino piñonero (Pinus pinea), fresno de hoja estrecha (Fraxinus angustifolia), olmo de Siberia (Ulmus pumila), falsa acacia (Robinia pseudoacacia).";"2";"http://www.madrid.es/sites/v/index.jsp?vgnextchannel=bfa48ab43d6bb410VgnVCM100000171f5a0aRCRD&vgnextoid=c097f9e8ecf33610VgnVCM2000001f4a900aRCRD";"Arroyo Pozuelo";"Calle";"T";"";"";"";"";"";"MADRID";"MADRID";"";"";"";"";"MONCLOA-ARAVACA";"433385";"4478502";"40.45451429342977";"-3.7856220495572703";"";"";"";""
5992721;"Parque Arroyo de los Pinos";"El Parque Arroyo de los Pinos es un espacio sencillo con amplias áreas ajardinadas, ubicado cerca de la M-30. Destaca por sus paseos rectos, que dividen en mosaico las zonas de césped y recreo. El parque presenta un arbolado dispuesto en línea, con suficiente amplitud entre los árboles, así como diversas especies arbustivas, lo que lo convierte en un lugar ideal para pasear, realizar actividades al aire libre o llevar a cabo paseos con mascotas. Además, el parque cuenta con dos zonas de juegos infantiles delimitadas, proporcionando un espacio seguro y divertido para los más pequeños. Es uno de los parque más recientes del distrito, en un entorno fuertemente urbanizado en el siglo XXI.";"";"Zonas infantiles";"Metro: Antonio Machado (linea 7) Bus: 132  Servicio Bicimad, para consultar la estación más cercana, acceda al mapa de geolocalización de las estaciones.";"Conservación: Dirección General de Gestión del Agua y Zonas Verdes, Área de Gobierno de Medio Ambiente y Movilidad.  Superficie: 25.798 m&amp;sup2;.  Vegetación predominante:    Ejemplares arbóreos: almez (Celtis australis), ciruelo rojo (Prunus cerasifera), cedro llorón (Cedrus deodara) y aligustre (Ligustrum japonicum).  Macizos arbustivos: tomillo (Thymus vulgaris), romero (Salvia rosmarinus) y cotoneaster (Cotoneaster horizontalis).";"2";"http://www.madrid.es/sites/v/index.jsp?vgnextchannel=bfa48ab43d6bb410VgnVCM100000171f5a0aRCRD&vgnextoid=3b97545fb44be210VgnVCM2000000c205a0aRCRD";"JOAQUIN LORENZO";"CALLE";"V";"21";"";"";"";"";"MADRID";"MADRID";"28035";"3";"PEÑA GRANDE";"8";"FUENCARRAL-EL PARDO";"438613";"4480559";"40.47343735166941";"-3.7241915440169024";"";"";"";"/contenido/entidadesYorganismos/ParquesJardines"
5982306;"Parque Avenida de Portugal";"El Parque Avenida de Portugal es un extenso paseo ajardinado que destaca por su diseño moderno y elegante. Su suelo está decorado con un estampado de grandes flores en empedrado portugués, en una paleta de tonos variados, acompañado de floridos cerezos que evocan la conexión con Extremadura. El mosaico de adoquines, en tonos negro y beige, recuerda los emblemáticos suelos de Lisboa, y las jardineras, con formas florales, contribuyen a crear un recorrido dinámico y singular para quienes lo transitan. Este parque ha transformado profundamente el área, dándole un nuevo enfoque estético y funcional, al estar construido sobre el túnel de la A-5.Este parque se construyó a la vez que Madrid Río, siendo finalizado en 2011.    Este parque ha transformado profundamente el área, dándole un nuevo enfoque estético y funcional, al estar construido sobre el túnel de la A-5.Este parque se construyó a la vez que Madrid Río, siendo finalizado en 2011.";"";"";"Bus: 25, 33, 31, 36, 39, 65, 138  Servicio Bicimad, para consultar la estación más cercana, acceda al mapa de geolocalización de las estaciones.";"Conservación: Dirección General de Gestión del Agua y Zonas Verdes, Área de Gobierno de Medio Ambiente y Movilidad.  Superficie: 30.719 m&amp;sup2;  Vegetación predominante:    Ejemplares arbóreos: Cerezo silvestre (Prunus avium).   Macizos arbustivos: Hiedra (Hedera helix).";"2";"http://www.madrid.es/sites/v/index.jsp?vgnextchannel=bfa48ab43d6bb410VgnVCM100000171f5a0aRCRD&vgnextoid=4838d459b008e210VgnVCM1000000b205a0aRCRD";"A-5";"AUTOVIA";"T";"300";"";"";"";"";"MADRID";"MADRID";"28011";"2";"PUERTA DEL ANGEL";"10";"LATINA";"437583";"4473763";"40.41214880704316";"-3.7356620312409365";"";"";"";"/contenido/entidadesYorganismos/ParquesJardines"
